assets/swish_gemm_128_3072_768.json
{"i": [["[\"swish_gemm\", 128, 3072, 768]", "metal -keys=metal,gpu -max_num_threads=1024", [-1, 16, 64, 32768, 2147483647, 1024, 2, 8]], [[], [["CI", 4], ["CI", 3], ["CHW", 2, "local"], ["SP", 2, 0, 128, [1, 1, 16, 4], 1], ["SP", 2, 5, 3072, [1, 12, 4, 4], 1], ["SP", 2, 10, 768, [6, 2], 1], ["RE", 2, [0, 5, 1, 6, 2, 7, 10, 11, 3, 8, 12, 4, 9]], ["FSP", 3, 0, 3, 3], ["FSP", 3, 4, 4, 3], ["RE", 3, [0, 4, 1, 5, 2, 6, 3, 7]], ["CA", 2, 3, 5], ["CHR", 1, "shared", [2]], ["CA", 2, 3, 6], ["CHR", 0, "shared", [3]], ["CA", 1, 4, 6], ["FU", 8, [0, 1]], ["SP", 8, 0, 393216, [8], 1], ["AN", 8, 0, 5], ["AN", 8, 1, 6], ["FU", 5, [0, 1]], ["AN", 5, 0, 5], ["FU", 5, [1, 2]], ["AN", 5, 1, 4], ["FU", 5, [2, 3]], ["AN", 5, 2, 6], ["FU", 3, [0, 1]], ["SP", 3, 0, 192, [1], 1], ["AN", 3, 1, 2], ["FFSP", 3, 0, [4, 3], 1, 1], ["AN", 3, 1, 6], ["FU", 1, [0, 1]], ["SP", 1, 0, 96, [2], 1], ["AN", 1, 1, 2], ["FFSP", 1, 0, [4, 3], 1, 1], ["AN", 1, 1, 6], ["PR", 4, 0, "auto_unroll_max_step$1024"]]]], "r": [[0.0156825, 0.0156451, 0.01564], 0, 2.49842, 1608111842], "v": "v0.4"}
{"i": [["[\"swish_gemm\", 128, 3072, 768]", "metal -keys=metal,gpu -max_num_threads=1024", [-1, 16, 64, 32768, 2147483647, 1024, 2, 8]], [[], [["CI", 4], ["CI", 3], ["CHW", 2, "local"], ["SP", 2, 0, 128, [2, 2, 4, 2], 1], ["SP", 2, 5, 3072, [1, 12, 2, 1], 1], ["SP", 2, 10, 768, [8, 1], 1], ["RE", 2, [0, 5, 1, 6, 2, 7, 10, 11, 3, 8, 12, 4, 9]], ["FSP", 3, 0, 3, 3], ["FSP", 3, 4, 4, 3], ["RE", 3, [0, 4, 1, 5, 2, 6, 3, 7]], ["CA", 2, 3, 5], ["CHR", 1, "shared", [2]], ["CA", 2, 3, 6], ["CHR", 0, "shared", [3]], ["CA", 1, 4, 6], ["FU", 8, [0, 1]], ["SP", 8, 0, 393216, [6], 1], ["AN", 8, 0, 5], ["AN", 8, 1, 6], ["FU", 5, [0, 1]], ["AN", 5, 0, 5], ["FU", 5, [1, 2]], ["AN", 5, 1, 4], ["FU", 5, [2, 3]], ["AN", 5, 2, 6], ["FU", 3, [0, 1]], ["SP", 3, 0, 16, [1], 1], ["AN", 3, 1, 2], ["FFSP", 3, 0, [4, 3], 1, 1], ["AN", 3, 1, 6], ["FU", 1, [0, 1]], ["SP", 1, 0, 64, [8], 1], ["AN", 1, 1, 2], ["FFSP", 1, 0, [4, 3], 1, 1], ["AN", 1, 1, 6], ["PR", 4, 0, "auto_unroll_max_step$0"]]]], "r": [[0.0022122, 0.00220984, 0.00220976], 0, 2.03163, 1608111844], "v": "v0.4"}
{"i": [["[\"swish_gemm\", 128, 3072, 768]", "metal -keys=metal,gpu -max_num_threads=1024", [-1, 16, 64, 32768, 2147483647, 1024, 2, 8]], [[], [["CI", 4], ["CI", 3], ["CHW", 2, "local"], ["SP", 2, 0, 128, [1, 1, 16, 4], 1], ["SP", 2, 5, 3072, [1, 24, 1, 4], 1], ["SP", 2, 10, 768, [2, 1], 1], ["RE", 2, [0, 5, 1, 6, 2, 7, 10, 11, 3, 8, 12, 4, 9]], ["FSP", 3, 0, 3, 3], ["FSP", 3, 4, 4, 3], ["RE", 3, [0, 4, 1, 5, 2, 6, 3, 7]], ["CA", 2, 3, 5], ["CHR", 1, "shared", [2]], ["CA", 2, 3, 6], ["CHR", 0, "shared", [3]], ["CA", 1, 4, 6], ["FU", 8, [0, 1]], ["SP", 8, 0, 393216, [8], 1], ["AN", 8, 0, 5], ["AN", 8, 1, 6], ["FU", 5, [0, 1]], ["AN", 5, 0, 5], ["FU", 5, [1, 2]], ["AN", 5, 1, 4], ["FU", 5, [2, 3]], ["AN", 5, 2, 6], ["FU", 3, [0, 1]], ["SP", 3, 0, 8, [1], 1], ["AN", 3, 1, 2], ["FFSP", 3, 0, [4, 3], 1, 1], ["AN", 3, 1, 6], ["FU", 1, [0, 1]], ["SP", 1, 0, 128, [1], 1], ["AN", 1, 1, 2], ["FFSP", 1, 0, [4, 3], 1, 1], ["AN", 1, 1, 6], ["PR", 4, 0, "auto_unroll_max_step$64"]]]], "r": [[0.0189166, 0.0189406, 0.0189275], 0, 1.81057, 1608111846], "v": "v0.4"}
{"i": [["[\"swish_gemm\", 128, 3072, 768]", "metal -keys=metal,gpu -max_num_threads=1024", [-1, 16, 64, 32768, 2147483647, 1024, 2, 8]], [[], [["CI", 4], ["CI", 3], ["CHW", 2, "local"], ["SP", 2, 0, 128, [8, 2, 1, 1], 1], ["SP", 2, 5, 3072, [1, 2, 6, 32], 1], ["SP", 2, 10, 768, [2, 2], 1], ["RE", 2, [0, 5, 1, 6, 2, 7, 10, 11, 3, 8, 12, 4, 9]], ["FSP", 3, 0, 3, 3], ["FSP", 3, 4, 4, 3], ["RE", 3, [0, 4, 1, 5, 2, 6, 3, 7]], ["CA", 2, 3, 5], ["CHR", 1, "shared", [2]], ["CA", 2, 3, 6], ["CHR", 0, "shared", [3]], ["CA", 1, 4, 6], ["FU", 8, [0, 1]], ["SP", 8, 0, 393216, [1], 1], ["AN", 8, 0, 5], ["AN", 8, 1, 6], ["FU", 5, [0, 1]], ["AN", 5, 0, 5], ["FU", 5, [1, 2]], ["AN", 5, 1, 4], ["FU", 5, [2, 3]], ["AN", 5, 2, 6], ["FU", 3, [0, 1]], ["SP", 3, 0, 768, [4], 1], ["AN", 3, 1, 2], ["FFSP", 3, 0, [4, 3], 1, 1], ["AN", 3, 1, 6], ["FU", 1, [0, 1]], ["SP", 1, 0, 4, [1], 1], ["AN", 1, 1, 2], ["FFSP", 1, 0, [4, 3], 1, 1], ["AN", 1, 1, 6], ["PR", 4, 0, "auto_unroll_max_step$64"]]]], "r": [[0.118842, 0.118991, 0.119051], 0, 2.02698, 1608111849], "v": "v0.4"}
{"i": [["[\"swish_gemm\", 128, 3072, 768]", "metal -keys=metal,gpu -max_num_threads=1024", [-1, 16, 64, 32768, 2147483647, 1024, 2, 8]], [[], [["CI", 4], ["CI", 3], ["CHW", 2, "local"], ["SP", 2, 0, 128, [2, 8, 1, 1], 1], ["SP", 2, 5, 3072, [1, 2, 6, 32], 1], ["SP", 2, 10, 768, [2, 2], 1], ["RE", 2, [0, 5, 1, 6, 2, 7, 10, 11, 3, 8, 12, 4, 9]], ["FSP", 3, 0, 3, 3], ["FSP", 3, 4, 4, 3], ["RE", 3, [0, 4, 1, 5, 2, 6, 3, 7]], ["CA", 2, 3, 5], ["CHR", 1, "shared", [2]], ["CA", 2, 3, 6], ["CHR", 0, "shared", [3]], ["CA", 1, 4, 6], ["FU", 8, [0, 1]], ["SP", 8, 0, 393216, [8], 1], ["AN", 8, 0, 5], ["AN", 8, 1, 6], ["FU", 5, [0, 1]], ["AN", 5, 0, 5], ["FU", 5, [1, 2]], ["AN", 5, 1, 4], ["FU", 5, [2, 3]], ["AN", 5, 2, 6], ["FU", 3, [0, 1]], ["SP", 3, 0, 768, [1], 1], ["AN", 3, 1, 2], ["FFSP", 3, 0, [4, 3], 1, 1], ["AN", 3, 1, 6], ["FU", 1, [0, 1]], ["SP", 1, 0, 4, [2], 1], ["AN", 1, 1, 2], ["FFSP", 1, 0, [4, 3], 1, 1], ["AN", 1, 1, 6], ["PR", 4, 0, "auto_unroll_max_step$64"]]]], "r": [[0.020599, 0.020567, 0.0205883], 0, 1.99582, 1608111851], "v": "v0.4"}
{"i": [["[\"swish_gemm\", 128, 3072, 768]", "metal -keys=metal,gpu -max_num_threads=1024", [-1, 16, 64, 32768, 2147483647, 1024, 2, 8]], [[], [["CI", 4], ["CI", 3], ["CHW", 2, "local"], ["SP", 2, 0, 128, [2, 2, 4, 2], 1], ["SP", 2, 5, 3072, [1, 12, 2, 1], 1], ["SP", 2, 10, 768, [8, 1], 1], ["RE", 2, [0, 5, 1, 6, 2, 7, 10, 11, 3, 8, 12, 4, 9]], ["FSP", 3, 0, 3, 3], ["FSP", 3, 4, 4, 3], ["RE", 3, [0, 4, 1, 5, 2, 6, 3, 7]], ["CA", 2, 3, 5], ["CHR", 1, "shared", [2]], ["CA", 2, 3, 6], ["CHR", 0, "shared", [3]], ["CA", 1, 4, 6], ["FU", 8, [0, 1]], ["SP", 8, 0, 393216, [2], 1], ["AN", 8, 0, 5], ["AN", 8, 1, 6], ["FU", 5, [0, 1]], ["AN", 5, 0, 5], ["FU", 5, [1, 2]], ["AN", 5, 1, 4], ["FU", 5, [2, 3]], ["AN", 5, 2, 6], ["FU", 3, [0, 1]], ["SP", 3, 0, 16, [16], 1], ["AN", 3, 1, 2], ["FFSP", 3, 0, [4, 3], 1, 1], ["AN", 3, 1, 6], ["FU", 1, [0, 1]], ["SP", 1, 0, 64, [1], 1], ["AN", 1, 1, 2], ["FFSP", 1, 0, [4, 3], 1, 1], ["AN", 1, 1, 6], ["PR", 4, 0, "auto_unroll_max_step$0"]]]], "r": [[0.00260928, 0.00261192, 0.00260257], 0, 2.33679, 1608111854], "v": "v0.4"}
{"i": [["[\"swish_gemm\", 128, 3072, 768]", "metal -keys=metal,gpu -max_num_threads=1024", [-1, 16, 64, 32768, 2147483647, 1024, 2, 8]], [[], [["CI", 4], ["CI", 3], ["CHW", 2, "local"], ["SP", 2, 0, 128, [1, 2, 2, 32], 1], ["SP", 2, 5, 3072, [1, 16, 1, 12], 1], ["SP", 2, 10, 768, [1, 24], 1], ["RE", 2, [0, 5, 1, 6, 2, 7, 10, 11, 3, 8, 12, 4, 9]], ["FSP", 3, 0, 3, 3], ["FSP", 3, 4, 4, 3], ["RE", 3, [0, 4, 1, 5, 2, 6, 3, 7]], ["CA", 2, 3, 5], ["CHR", 1, "shared", [2]], ["CA", 2, 3, 6], ["CHR", 0, "shared", [3]], ["CA", 1, 4, 6], ["FU", 8, [0, 1]], ["SP", 8, 0, 393216, [24], 1], ["AN", 8, 0, 5], ["AN", 8, 1, 6], ["FU", 5, [0, 1]], ["AN", 5, 0, 5], ["FU", 5, [1, 2]], ["AN", 5, 1, 4], ["FU", 5, [2, 3]], ["AN", 5, 2, 6], ["FU", 3, [0, 1]], ["SP", 3, 0, 288, [1], 1], ["AN", 3, 1, 2], ["FFSP", 3, 0, [4, 3], 1, 1], ["AN", 3, 1, 6], ["FU", 1, [0, 1]], ["SP", 1, 0, 1536, [1], 1], ["AN", 1, 1, 2], ["FFSP", 1, 0, [4, 3], 1, 1], ["AN", 1, 1, 6], ["PR", 4, 0, "auto_unroll_max_step$16"]]]], "r": [[0.0324149, 0.0324358, 0.0324289], 0, 2.06632, 1608111856], "v": "v0.4"}
{"i": [["[\"swish_gemm\", 128, 3072, 768]", "metal -keys=metal,gpu -max_num_threads=1024", [-1, 16, 64, 32768, 2147483647, 1024, 2, 8]], [[], [["CI", 4], ["CI", 3], ["CHW", 2, "local"], ["SP", 2, 0, 128, [1, 1, 16, 4], 1], ["SP", 2, 5, 3072, [1, 96, 1, 1], 1], ["SP", 2, 10, 768, [1, 1], 1], ["RE", 2, [0, 5, 1, 6, 2, 7, 10, 11, 3, 8, 12, 4, 9]], ["FSP", 3, 0, 3, 3], ["FSP", 3, 4, 4, 3], ["RE", 3, [0, 4, 1, 5, 2, 6, 3, 7]], ["CA", 2, 3, 5], ["CHR", 1, "shared", [2]], ["CA", 2, 3, 6], ["CHR", 0, "shared", [3]], ["CA", 1, 4, 6], ["FU", 8, [0, 1]], ["SP", 8, 0, 393216, [8], 1], ["AN", 8, 0, 5], ["AN", 8, 1, 6], ["FU", 5, [0, 1]], ["AN", 5, 0, 5], ["FU", 5, [1, 2]], ["AN", 5, 1, 4], ["FU", 5, [2, 3]], ["AN", 5, 2, 6], ["FU", 3, [0, 1]], ["SP", 3, 0, 8, [1], 1], ["AN", 3, 1, 2], ["FFSP", 3, 0, [4, 3], 1, 1], ["AN", 3, 1, 6], ["FU", 1, [0, 1]], ["SP", 1, 0, 128, [1], 1], ["AN", 1, 1, 2], ["FFSP", 1, 0, [4, 3], 1, 1], ["AN", 1, 1, 6], ["PR", 4, 0, "auto_unroll_max_step$1024"]]]], "r": [[0.00168457, 0.00168251, 0.00168308], 0, 1.88528, 1608111858], "v": "v0.4"}
{"i": [["[\"swish_gemm\", 128, 3072, 768]", "metal -keys=metal,gpu -max_num_threads=1024", [-1, 16, 64, 32768, 2147483647, 1024, 2, 8]], [[], [["CI", 4], ["CI", 3], ["CHW", 2, "local"], ["SP", 2, 0, 128, [2, 8, 1, 1], 1], ["SP", 2, 5, 3072, [1, 3, 4, 1], 1], ["SP", 2, 10, 768, [1, 32], 1], ["RE", 2, [0, 5, 1, 6, 2, 7, 10, 11, 3, 8, 12, 4, 9]], ["FSP", 3, 0, 3, 3], ["FSP", 3, 4, 4, 3], ["RE", 3, [0, 4, 1, 5, 2, 6, 3, 7]], ["CA", 2, 3, 5], ["CHR", 1, "shared", [2]], ["CA", 2, 3, 6], ["CHR", 0, "shared", [3]], ["CA", 1, 4, 6], ["FU", 8, [0, 1]], ["SP", 8, 0, 393216, [6], 1], ["AN", 8, 0, 5], ["AN", 8, 1, 6], ["FU", 5, [0, 1]], ["AN", 5, 0, 5], ["FU", 5, [1, 2]], ["AN", 5, 1, 4], ["FU", 5, [2, 3]], ["AN", 5, 2, 6], ["FU", 3, [0, 1]], ["SP", 3, 0, 512, [1], 1], ["AN", 3, 1, 2], ["FFSP", 3, 0, [4, 3], 1, 1], ["AN", 3, 1, 6], ["FU", 1, [0, 1]], ["SP", 1, 0, 128, [1], 1], ["AN", 1, 1, 2], ["FFSP", 1, 0, [4, 3], 1, 1], ["AN", 1, 1, 6], ["PR", 4, 0, "auto_unroll_max_step$64"]]]], "r": [[0.00167344, 0.00167625, 0.00167287], 0, 2.85502, 1608111861], "v": "v0.4"}
{"i": [["[\"swish_gemm\", 128, 3072, 768]", "metal -keys=metal,gpu -max_num_threads=1024", [-1, 16, 64, 32768, 2147483647, 1024, 2, 8]], [[], [["CI", 4], ["CI", 3], ["CHW", 2, "local"], ["SP", 2, 0, 128, [1, 8, 1, 4], 1], ["SP", 2, 5, 3072, [1, 48, 1, 4], 1], ["SP", 2, 10, 768, [3, 4], 1], ["RE", 2, [0, 5, 1, 6, 2, 7, 10, 11, 3, 8, 12, 4, 9]], ["FSP", 3, 0, 3, 3], ["FSP", 3, 4, 4, 3], ["RE", 3, [0, 4, 1, 5, 2, 6, 3, 7]], ["CA", 2, 3, 5], ["CHR", 1, "shared", [2]], ["CA", 2, 3, 6], ["CHR", 0, "shared", [3]], ["CA", 1, 4, 6], ["FU", 8, [0, 1]], ["SP", 8, 0, 393216, [8], 1], ["AN", 8, 0, 5], ["AN", 8, 1, 6], ["FU", 5, [0, 1]], ["AN", 5, 0, 5], ["FU", 5, [1, 2]], ["AN", 5, 1, 4], ["FU", 5, [2, 3]], ["AN", 5, 2, 6], ["FU", 3, [0, 1]], ["SP", 3, 0, 48, [1], 1], ["AN", 3, 1, 2], ["FFSP", 3, 0, [4, 3], 1, 1], ["AN", 3, 1, 6], ["FU", 1, [0, 1]], ["SP", 1, 0, 48, [1], 1], ["AN", 1, 1, 2], ["FFSP", 1, 0, [4, 3], 1, 1], ["AN", 1, 1, 6], ["PR", 4, 0, "auto_unroll_max_step$1024"]]]], "r": [[0.00182661, 0.00182818, 0.00183048], 0, 1.91569, 1608111863], "v": "v0.4"}
{"i": [["[\"swish_gemm\", 128, 3072, 768]", "metal -keys=metal,gpu -max_num_threads=1024", [-1, 16, 64, 32768, 2147483647, 1024, 2, 8]], [[], [["CI", 4], ["CI", 3], ["CHW", 2, "local"], ["SP", 2, 0, 128, [4, 4, 1, 8], 1], ["SP", 2, 5, 3072, [2, 3, 1, 4], 1], ["SP", 2, 10, 768, [4, 4], 1], ["RE", 2, [0, 5, 1, 6, 2, 7, 10, 11, 3, 8, 12, 4, 9]], ["FSP", 3, 0, 3, 3], ["FSP", 3, 4, 4, 3], ["RE", 3, [0, 4, 1, 5, 2, 6, 3, 7]], ["CA", 2, 3, 5], ["CHR", 1, "shared", [2]], ["CA", 2, 3, 6], ["CHR", 0, "shared", [3]], ["CA", 1, 4, 6], ["FU", 8, [0, 1]], ["SP", 8, 0, 393216, [2], 1], ["AN", 8, 0, 5], ["AN", 8, 1, 6], ["FU", 5, [0, 1]], ["AN", 5, 0, 5], ["FU", 5, [1, 2]], ["AN", 5, 1, 4], ["FU", 5, [2, 3]], ["AN", 5, 2, 6], ["FU", 3, [0, 1]], ["SP", 3, 0, 128, [1], 1], ["AN", 3, 1, 2], ["FFSP", 3, 0, [4, 3], 1, 1], ["AN", 3, 1, 6], ["FU", 1, [0, 1]], ["SP", 1, 0, 256, [4], 1], ["AN", 1, 1, 2], ["FFSP", 1, 0, [4, 3], 1, 1], ["AN", 1, 1, 6], ["PR", 4, 0, "auto_unroll_max_step$512"]]]], "r": [[0.0916816, 0.0960513, 0.091471], 0, 2.78527, 1608111867], "v": "v0.4"}
{"i": [["[\"swish_gemm\", 128, 3072, 768]", "metal -keys=metal,gpu -max_num_threads=1024", [-1, 16, 64, 32768, 2147483647, 1024, 2, 8]], [[], [["CI", 4], ["CI", 3], ["CHW", 2, "local"], ["SP", 2, 0, 128, [1, 4, 2, 8], 1], ["SP", 2, 5, 3072, [1, 12, 32, 2], 1], ["SP", 2, 10, 768, [2, 1], 1], ["RE", 2, [0, 5, 1, 6, 2, 7, 10, 11, 3, 8, 12, 4, 9]], ["FSP", 3, 0, 3, 3], ["FSP", 3, 4, 4, 3], ["RE", 3, [0, 4, 1, 5, 2, 6, 3, 7]], ["CA", 2, 3, 5], ["CHR", 1, "shared", [2]], ["CA", 2, 3, 6], ["CHR", 0, "shared", [3]], ["CA", 1, 4, 6], ["FU", 8, [0, 1]], ["SP", 8, 0, 393216, [16], 1], ["AN", 8, 0, 5], ["AN", 8, 1, 6], ["FU", 5, [0, 1]], ["AN", 5, 0, 5], ["FU", 5, [1, 2]], ["AN", 5, 1, 4], ["FU", 5, [2, 3]], ["AN", 5, 2, 6], ["FU", 3, [0, 1]], ["SP", 3, 0, 128, [1], 1], ["AN", 3, 1, 2], ["FFSP", 3, 0, [4, 3], 1, 1], ["AN", 3, 1, 6], ["FU", 1, [0, 1]], ["SP", 1, 0, 32, [1], 1], ["AN", 1, 1, 2], ["FFSP", 1, 0, [4, 3], 1, 1], ["AN", 1, 1, 6], ["PR", 4, 0, "auto_unroll_max_step$64"]]]], "r": [[0.0851461, 0.0848262, 0.085056], 0, 2.28311, 1608111869], "v": "v0.4"}
{"i": [["[\"swish_gemm\", 128, 3072, 768]", "metal -keys=metal,gpu -max_num_threads=1024", [-1, 16, 64, 32768, 2147483647, 1024, 2, 8]], [[], [["CI", 4], ["CI", 3], ["CHW", 2, "local"], ["SP", 2, 0, 128, [1, 16, 1, 1], 1], ["SP", 2, 5, 3072, [2, 4, 8, 4], 1], ["SP", 2, 10, 768, [8, 3], 1], ["RE", 2, [0, 5, 1, 6, 2, 7, 10, 11, 3, 8, 12, 4, 9]], ["FSP", 3, 0, 3, 3], ["FSP", 3, 4, 4, 3], ["RE", 3, [0, 4, 1, 5, 2, 6, 3, 7]], ["CA", 2, 3, 5], ["CHR", 1, "shared", [2]], ["CA", 2, 3, 6], ["CHR", 0, "shared", [3]], ["CA", 1, 4, 6], ["FU", 8, [0, 1]], ["SP", 8, 0, 393216, [8], 1], ["AN", 8, 0, 5], ["AN", 8, 1, 6], ["FU", 5, [0, 1]], ["AN", 5, 0, 5], ["FU", 5, [1, 2]], ["AN", 5, 1, 4], ["FU", 5, [2, 3]], ["AN", 5, 2, 6], ["FU", 3, [0, 1]], ["SP", 3, 0, 384, [1], 1], ["AN", 3, 1, 2], ["FFSP", 3, 0, [4, 3], 1, 1], ["AN", 3, 1, 6], ["FU", 1, [0, 1]], ["SP", 1, 0, 24, [1], 1], ["AN", 1, 1, 2], ["FFSP", 1, 0, [4, 3], 1, 1], ["AN", 1, 1, 6], ["PR", 4, 0, "auto_unroll_max_step$1024"]]]], "r": [[0.00541678, 0.00538462, 0.00546129], 0, 2.62869, 1608111872], "v": "v0.4"}
{"i": [["[\"swish_gemm\", 128, 3072, 768]", "metal -keys=metal,gpu -max_num_threads=1024", [-1, 16, 64, 32768, 2147483647, 1024, 2, 8]], [[], [["CI", 4], ["CI", 3], ["CHW", 2, "local"], ["SP", 2, 0, 128, [1, 2, 2, 32], 1], ["SP", 2, 5, 3072, [1, 16, 1, 12], 1], ["SP", 2, 10, 768, [1, 24], 1], ["RE", 2, [0, 5, 1, 6, 2, 7, 10, 11, 3, 8, 12, 4, 9]], ["FSP", 3, 0, 3, 3], ["FSP", 3, 4, 4, 3], ["RE", 3, [0, 4, 1, 5, 2, 6, 3, 7]], ["CA", 2, 3, 5], ["CHR", 1, "shared", [2]], ["CA", 2, 3, 6], ["CHR", 0, "shared", [3]], ["CA", 1, 4, 6], ["FU", 8, [0, 1]], ["SP", 8, 0, 393216, [8], 1], ["AN", 8, 0, 5], ["AN", 8, 1, 6], ["FU", 5, [0, 1]], ["AN", 5, 0, 5], ["FU", 5, [1, 2]], ["AN", 5, 1, 4], ["FU", 5, [2, 3]], ["AN", 5, 2, 6], ["FU", 3, [0, 1]], ["SP", 3, 0, 288, [1], 1], ["AN", 3, 1, 2], ["FFSP", 3, 0, [4, 3], 1, 1], ["AN", 3, 1, 6], ["FU", 1, [0, 1]], ["SP", 1, 0, 1536, [1], 1], ["AN", 1, 1, 2], ["FFSP", 1, 0, [4, 3], 1, 1], ["AN", 1, 1, 6], ["PR", 4, 0, "auto_unroll_max_step$16"]]]], "r": [[0.0315051, 0.0315407, 0.031518], 0, 1.76173, 1608111874], "v": "v0.4"}
{"i": [["[\"swish_gemm\", 128, 3072, 768]", "metal -keys=metal,gpu -max_num_threads=1024", [-1, 16, 64, 32768, 2147483647, 1024, 2, 8]], [[], [["CI", 4], ["CI", 3], ["CHW", 2, "local"], ["SP", 2, 0, 128, [1, 4, 32, 1], 1], ["SP", 2, 5, 3072, [2, 2, 1, 3], 1], ["SP", 2, 10, 768, [1, 8], 1], ["RE", 2, [0, 5, 1, 6, 2, 7, 10, 11, 3, 8, 12, 4, 9]], ["FSP", 3, 0, 3, 3], ["FSP", 3, 4, 4, 3], ["RE", 3, [0, 4, 1, 5, 2, 6, 3, 7]], ["CA", 2, 3, 5], ["CHR", 1, "shared", [2]], ["CA", 2, 3, 6], ["CHR", 0, "shared", [3]], ["CA", 1, 4, 6], ["FU", 8, [0, 1]], ["SP", 8, 0, 393216, [64], 1], ["AN", 8, 0, 5], ["AN", 8, 1, 6], ["FU", 5, [0, 1]], ["AN", 5, 0, 5], ["FU", 5, [1, 2]], ["AN", 5, 1, 4], ["FU", 5, [2, 3]], ["AN", 5, 2, 6], ["FU", 3, [0, 1]], ["SP", 3, 0, 24, [2], 1], ["AN", 3, 1, 2], ["FFSP", 3, 0, [4, 3], 1, 1], ["AN", 3, 1, 6], ["FU", 1, [0, 1]], ["SP", 1, 0, 256, [4], 1], ["AN", 1, 1, 2], ["FFSP", 1, 0, [4, 3], 1, 1], ["AN", 1, 1, 6], ["PR", 4, 0, "auto_unroll_max_step$16"]]]], "r": [[0.00850474, 0.00850567, 0.00850401], 0, 2.48341, 1608111877], "v": "v0.4"}
{"i": [["[\"swish_gemm\", 128, 3072, 768]", "metal -keys=metal,gpu -max_num_threads=1024", [-1, 16, 64, 32768, 2147483647, 1024, 2, 8]], [[], [["CI", 4], ["CI", 3], ["CHW", 2, "local"], ["SP", 2, 0, 128, [1, 1, 2, 4], 1], ["SP", 2, 5, 3072, [1, 12, 4, 4], 1], ["SP", 2, 10, 768, [6, 2], 1], ["RE", 2, [0, 5, 1, 6, 2, 7, 10, 11, 3, 8, 12, 4, 9]], ["FSP", 3, 0, 3, 3], ["FSP", 3, 4, 4, 3], ["RE", 3, [0, 4, 1, 5, 2, 6, 3, 7]], ["CA", 2, 3, 5], ["CHR", 1, "shared", [2]], ["CA", 2, 3, 6], ["CHR", 0, "shared", [3]], ["CA", 1, 4, 6], ["FU", 8, [0, 1]], ["SP", 8, 0, 393216, [8], 1], ["AN", 8, 0, 5], ["AN", 8, 1, 6], ["FU", 5, [0, 1]], ["AN", 5, 0, 5], ["FU", 5, [1, 2]], ["AN", 5, 1, 4], ["FU", 5, [2, 3]], ["AN", 5, 2, 6], ["FU", 3, [0, 1]], ["SP", 3, 0, 192, [1], 1], ["AN", 3, 1, 2], ["FFSP", 3, 0, [4, 3], 1, 1], ["AN", 3, 1, 6], ["FU", 1, [0, 1]], ["SP", 1, 0, 96, [16], 1], ["AN", 1, 1, 2], ["FFSP", 1, 0, [4, 3], 1, 1], ["AN", 1, 1, 6], ["PR", 4, 0, "auto_unroll_max_step$1024"]]]], "r": [[0.0290629, 0.029112, 0.0288317], 0, 2.11464, 1608111879], "v": "v0.4"}
{"i": [["[\"swish_gemm\", 128, 3072, 768]", "metal -keys=metal,gpu -max_num_threads=1024", [-1, 16, 64, 32768, 2147483647, 1024, 2, 8]], [[], [["CI", 4], ["CI", 3], ["CHW", 2, "local"], ["SP", 2, 0, 128, [1, 4, 32, 1], 1], ["SP", 2, 5, 3072, [2, 2, 1, 3], 1], ["SP", 2, 10, 768, [1, 24], 1], ["RE", 2, [0, 5, 1, 6, 2, 7, 10, 11, 3, 8, 12, 4, 9]], ["FSP", 3, 0, 3, 3], ["FSP", 3, 4, 4, 3], ["RE", 3, [0, 4, 1, 5, 2, 6, 3, 7]], ["CA", 2, 3, 5], ["CHR", 1, "shared", [2]], ["CA", 2, 3, 6], ["CHR", 0, "shared", [3]], ["CA", 1, 4, 6], ["FU", 8, [0, 1]], ["SP", 8, 0, 393216, [8], 1], ["AN", 8, 0, 5], ["AN", 8, 1, 6], ["FU", 5, [0, 1]], ["AN", 5, 0, 5], ["FU", 5, [1, 2]], ["AN", 5, 1, 4], ["FU", 5, [2, 3]], ["AN", 5, 2, 6], ["FU", 3, [0, 1]], ["SP", 3, 0, 24, [1], 1], ["AN", 3, 1, 2], ["FFSP", 3, 0, [4, 3], 1, 1], ["AN", 3, 1, 6], ["FU", 1, [0, 1]], ["SP", 1, 0, 256, [1], 1], ["AN", 1, 1, 2], ["FFSP", 1, 0, [4, 3], 1, 1], ["AN", 1, 1, 6], ["PR", 4, 0, "auto_unroll_max_step$16"]]]], "r": [[0.0141041, 0.0141694, 0.0141], 0, 1.86204, 1608111881], "v": "v0.4"}
{"i": [["[\"swish_gemm\", 128, 3072, 768]", "metal -keys=metal,gpu -max_num_threads=1024", [-1, 16, 64, 32768, 2147483647, 1024, 2, 8]], [[], [["CI", 4], ["CI", 3], ["CHW", 2, "local"], ["SP", 2, 0, 128, [4, 8, 1, 2], 1], ["SP", 2, 5, 3072, [1, 16, 8, 3], 1], ["SP", 2, 10, 768, [1, 6], 1], ["RE", 2, [0, 5, 1, 6, 2, 7, 10, 11, 3, 8, 12, 4, 9]], ["FSP", 3, 0, 3, 3], ["FSP", 3, 4, 4, 3], ["RE", 3, [0, 4, 1, 5, 2, 6, 3, 7]], ["CA", 2, 3, 5], ["CHR", 1, "shared", [2]], ["CA", 2, 3, 6], ["CHR", 0, "shared", [3]], ["CA", 1, 4, 6], ["FU", 8, [0, 1]], ["SP", 8, 0, 393216, [4], 1], ["AN", 8, 0, 5], ["AN", 8, 1, 6], ["FU", 5, [0, 1]], ["AN", 5, 0, 5], ["FU", 5, [1, 2]], ["AN", 5, 1, 4], ["FU", 5, [2, 3]], ["AN", 5, 2, 6], ["FU", 3, [0, 1]], ["SP", 3, 0, 144, [1], 1], ["AN", 3, 1, 2], ["FFSP", 3, 0, [4, 3], 1, 1], ["AN", 3, 1, 6], ["FU", 1, [0, 1]], ["SP", 1, 0, 48, [1], 1], ["AN", 1, 1, 2], ["FFSP", 1, 0, [4, 3], 1, 1], ["AN", 1, 1, 6], ["PR", 4, 0, "auto_unroll_max_step$0"]]]], "r": [[0.00562077, 0.00562313, 0.00562282], 0, 2.2975, 1608111884], "v": "v0.4"}
{"i": [["[\"swish_gemm\", 128, 3072, 768]", "metal -keys=metal,gpu -max_num_threads=1024", [-1, 16, 64, 32768, 2147483647, 1024, 2, 8]], [[], [["CI", 4], ["CI", 3], ["CHW", 2, "local"], ["SP", 2, 0, 128, [2, 1, 1, 16], 1], ["SP", 2, 5, 3072, [1, 16, 3, 2], 1], ["SP", 2, 10, 768, [16, 4], 1], ["RE", 2, [0, 5, 1, 6, 2, 7, 10, 11, 3, 8, 12, 4, 9]], ["FSP", 3, 0, 3, 3], ["FSP", 3, 4, 4, 3], ["RE", 3, [0, 4, 1, 5, 2, 6, 3, 7]], ["CA", 2, 3, 5], ["CHR", 1, "shared", [2]], ["CA", 2, 3, 6], ["CHR", 0, "shared", [3]], ["CA", 1, 4, 6], ["FU", 8, [0, 1]], ["SP", 8, 0, 393216, [8], 1], ["AN", 8, 0, 5], ["AN", 8, 1, 6], ["FU", 5, [0, 1]], ["AN", 5, 0, 5], ["FU", 5, [1, 2]], ["AN", 5, 1, 4], ["FU", 5, [2, 3]], ["AN", 5, 2, 6], ["FU", 3, [0, 1]], ["SP", 3, 0, 384, [1], 1], ["AN", 3, 1, 2], ["FFSP", 3, 0, [4, 3], 1, 1], ["AN", 3, 1, 6], ["FU", 1, [0, 1]], ["SP", 1, 0, 1024, [4], 1], ["AN", 1, 1, 2], ["FFSP", 1, 0, [4, 3], 1, 1], ["AN", 1, 1, 6], ["PR", 4, 0, "auto_unroll_max_step$16"]]]], "r": [[0.0421202, 0.0422784, 0.0428513], 0, 2.13064, 1608111886], "v": "v0.4"}
{"i": [["[\"swish_gemm\", 128, 3072, 768]", "metal -keys=metal,gpu -max_num_threads=1024", [-1, 16, 64, 32768, 2147483647, 1024, 2, 8]], [[], [["CI", 4], ["CI", 3], ["CHW", 2, "local"], ["SP", 2, 0, 128, [1, 2, 1, 8], 1], ["SP", 2, 5, 3072, [1, 8, 1, 48], 1], ["SP", 2, 10, 768, [2, 6], 1], ["RE", 2, [0, 5, 1, 6, 2, 7, 10, 11, 3, 8, 12, 4, 9]], ["FSP", 3, 0, 3, 3], ["FSP", 3, 4, 4, 3], ["RE", 3, [0, 4, 1, 5, 2, 6, 3, 7]], ["CA", 2, 3, 5], ["CHR", 1, "shared", [2]], ["CA", 2, 3, 6], ["CHR", 0, "shared", [3]], ["CA", 1, 4, 6], ["FU", 8, [0, 1]], ["SP", 8, 0, 393216, [8], 1], ["AN", 8, 0, 5], ["AN", 8, 1, 6], ["FU", 5, [0, 1]], ["AN", 5, 0, 5], ["FU", 5, [1, 2]], ["AN", 5, 1, 4], ["FU", 5, [2, 3]], ["AN", 5, 2, 6], ["FU", 3, [0, 1]], ["SP", 3, 0, 144, [1], 1], ["AN", 3, 1, 2], ["FFSP", 3, 0, [4, 3], 1, 1], ["AN", 3, 1, 6], ["FU", 1, [0, 1]], ["SP", 1, 0, 96, [32], 1], ["AN", 1, 1, 2], ["FFSP", 1, 0, [4, 3], 1, 1], ["AN", 1, 1, 6], ["PR", 4, 0, "auto_unroll_max_step$64"]]]], "r": [[0.0378821, 0.0378959, 0.0383357], 0, 1.99343, 1608111889], "v": "v0.4"}
{"i": [["[\"swish_gemm\", 128, 3072, 768]", "metal -keys=metal,gpu -max_num_threads=1024", [-1, 16, 64, 32768, 2147483647, 1024, 2, 8]], [[], [["CI", 4], ["CI", 3], ["CHW", 2, "local"], ["SP", 2, 0, 128, [1, 1, 4, 1], 1], ["SP", 2, 5, 3072, [1, 32, 4, 3], 1], ["SP", 2, 10, 768, [4, 2], 1], ["RE", 2, [0, 5, 1, 6, 2, 7, 10, 11, 3, 8, 12, 4, 9]], ["FSP", 3, 0, 3, 3], ["FSP", 3, 4, 4, 3], ["RE", 3, [0, 4, 1, 5, 2, 6, 3, 7]], ["CA", 2, 3, 5], ["CHR", 1, "shared", [2]], ["CA", 2, 3, 6], ["CHR", 0, "shared", [3]], ["CA", 1, 4, 6], ["FU", 8, [0, 1]], ["SP", 8, 0, 393216, [8], 1], ["AN", 8, 0, 5], ["AN", 8, 1, 6], ["FU", 5, [0, 1]], ["AN", 5, 0, 5], ["FU", 5, [1, 2]], ["AN", 5, 1, 4], ["FU", 5, [2, 3]], ["AN", 5, 2, 6], ["FU", 3, [0, 1]], ["SP", 3, 0, 96, [1], 1], ["AN", 3, 1, 2], ["FFSP", 3, 0, [4, 3], 1, 1], ["AN", 3, 1, 6], ["FU", 1, [0, 1]], ["SP", 1, 0, 16, [1], 1], ["AN", 1, 1, 2], ["FFSP", 1, 0, [4, 3], 1, 1], ["AN", 1, 1, 6], ["PR", 4, 0, "auto_unroll_max_step$512"]]]], "r": [[0.00514581, 0.00514398, 0.00514796], 0, 2.59873, 1608111891], "v": "v0.4"}
{"i": [["[\"swish_gemm\", 128, 3072, 768]", "metal -keys=metal,gpu -max_num_threads=1024", [-1, 16, 64, 32768, 2147483647, 1024, 2, 8]], [[], [["CI", 4], ["CI", 3], ["CHW", 2, "local"], ["SP", 2, 0, 128, [1, 8, 1, 16], 1], ["SP", 2, 5, 3072, [2, 1, 8, 6], 1], ["SP", 2, 10, 768, [1, 3], 1], ["RE", 2, [0, 5, 1, 6, 2, 7, 10, 11, 3, 8, 12, 4, 9]], ["FSP", 3, 0, 3, 3], ["FSP", 3, 4, 4, 3], ["RE", 3, [0, 4, 1, 5, 2, 6, 3, 7]], ["CA", 2, 3, 5], ["CHR", 1, "shared", [2]], ["CA", 2, 3, 6], ["CHR", 0, "shared", [3]], ["CA", 1, 4, 6], ["FU", 8, [0, 1]], ["SP", 8, 0, 393216, [8], 1], ["AN", 8, 0, 5], ["AN", 8, 1, 6], ["FU", 5, [0, 1]], ["AN", 5, 0, 5], ["FU", 5, [1, 2]], ["AN", 5, 1, 4], ["FU", 5, [2, 3]], ["AN", 5, 2, 6], ["FU", 3, [0, 1]], ["SP", 3, 0, 144, [1], 1], ["AN", 3, 1, 2], ["FFSP", 3, 0, [4, 3], 1, 1], ["AN", 3, 1, 6], ["FU", 1, [0, 1]], ["SP", 1, 0, 48, [1], 1], ["AN", 1, 1, 2], ["FFSP", 1, 0, [4, 3], 1, 1], ["AN", 1, 1, 6], ["PR", 4, 0, "auto_unroll_max_step$0"]]]], "r": [[0.055007, 0.0549991, 0.0548969], 0, 2.1535, 1608111894], "v": "v0.4"}
{"i": [["[\"swish_gemm\", 128, 3072, 768]", "metal -keys=metal,gpu -max_num_threads=1024", [-1, 16, 64, 32768, 2147483647, 1024, 2, 8]], [[], [["CI", 4], ["CI", 3], ["CHW", 2, "local"], ["SP", 2, 0, 128, [1, 4, 2, 8], 1], ["SP", 2, 5, 3072, [1, 6, 1, 2], 1], ["SP", 2, 10, 768, [48, 2], 1], ["RE", 2, [0, 5, 1, 6, 2, 7, 10, 11, 3, 8, 12, 4, 9]], ["FSP", 3, 0, 3, 3], ["FSP", 3, 4, 4, 3], ["RE", 3, [0, 4, 1, 5, 2, 6, 3, 7]], ["CA", 2, 3, 5], ["CHR", 1, "shared", [2]], ["CA", 2, 3, 6], ["CHR", 0, "shared", [3]], ["CA", 1, 4, 6], ["FU", 8, [0, 1]], ["SP", 8, 0, 393216, [2], 1], ["AN", 8, 0, 5], ["AN", 8, 1, 6], ["FU", 5, [0, 1]], ["AN", 5, 0, 5], ["FU", 5, [1, 2]], ["AN", 5, 1, 4], ["FU", 5, [2, 3]], ["AN", 5, 2, 6], ["FU", 3, [0, 1]], ["SP", 3, 0, 4, [1], 1], ["AN", 3, 1, 2], ["FFSP", 3, 0, [4, 3], 1, 1], ["AN", 3, 1, 6], ["FU", 1, [0, 1]], ["SP", 1, 0, 32, [1], 1], ["AN", 1, 1, 2], ["FFSP", 1, 0, [4, 3], 1, 1], ["AN", 1, 1, 6], ["PR", 4, 0, "auto_unroll_max_step$512"]]]], "r": [[0.0231925, 0.0232818, 0.0231755], 0, 2.21119, 1608111896], "v": "v0.4"}
{"i": [["[\"swish_gemm\", 128, 3072, 768]", "metal -keys=metal,gpu -max_num_threads=1024", [-1, 16, 64, 32768, 2147483647, 1024, 2, 8]], [[], [["CI", 4], ["CI", 3], ["CHW", 2, "local"], ["SP", 2, 0, 128, [1, 2, 2, 32], 1], ["SP", 2, 5, 3072, [1, 4, 1, 48], 1], ["SP", 2, 10, 768, [1, 24], 1], ["RE", 2, [0, 5, 1, 6, 2, 7, 10, 11, 3, 8, 12, 4, 9]], ["FSP", 3, 0, 3, 3], ["FSP", 3, 4, 4, 3], ["RE", 3, [0, 4, 1, 5, 2, 6, 3, 7]], ["CA", 2, 3, 5], ["CHR", 1, "shared", [2]], ["CA", 2, 3, 6], ["CHR", 0, "shared", [3]], ["CA", 1, 4, 6], ["FU", 8, [0, 1]], ["SP", 8, 0, 393216, [8], 1], ["AN", 8, 0, 5], ["AN", 8, 1, 6], ["FU", 5, [0, 1]], ["AN", 5, 0, 5], ["FU", 5, [1, 2]], ["AN", 5, 1, 4], ["FU", 5, [2, 3]], ["AN", 5, 2, 6], ["FU", 3, [0, 1]], ["SP", 3, 0, 288, [1], 1], ["AN", 3, 1, 2], ["FFSP", 3, 0, [4, 3], 1, 1], ["AN", 3, 1, 6], ["FU", 1, [0, 1]], ["SP", 1, 0, 1536, [1], 1], ["AN", 1, 1, 2], ["FFSP", 1, 0, [4, 3], 1, 1], ["AN", 1, 1, 6], ["PR", 4, 0, "auto_unroll_max_step$16"]]]], "r": [[0.125651, 0.126331, 0.125621], 0, 2.10077, 1608111899], "v": "v0.4"}
{"i": [["[\"swish_gemm\", 128, 3072, 768]", "metal -keys=metal,gpu -max_num_threads=1024", [-1, 16, 64, 32768, 2147483647, 1024, 2, 8]], [[], [["CI", 4], ["CI", 3], ["CHW", 2, "local"], ["SP", 2, 0, 128, [1, 8, 2, 8], 1], ["SP", 2, 5, 3072, [1, 12, 64, 2], 1], ["SP", 2, 10, 768, [2, 1], 1], ["RE", 2, [0, 5, 1, 6, 2, 7, 10, 11, 3, 8, 12, 4, 9]], ["FSP", 3, 0, 3, 3], ["FSP", 3, 4, 4, 3], ["RE", 3, [0, 4, 1, 5, 2, 6, 3, 7]], ["CA", 2, 3, 5], ["CHR", 1, "shared", [2]], ["CA", 2, 3, 6], ["CHR", 0, "shared", [3]], ["CA", 1, 4, 6], ["FU", 8, [0, 1]], ["SP", 8, 0, 393216, [8], 1], ["AN", 8, 0, 5], ["AN", 8, 1, 6], ["FU", 5, [0, 1]], ["AN", 5, 0, 5], ["FU", 5, [1, 2]], ["AN", 5, 1, 4], ["FU", 5, [2, 3]], ["AN", 5, 2, 6], ["FU", 3, [0, 1]], ["SP", 3, 0, 128, [1], 1], ["AN", 3, 1, 2], ["FFSP", 3, 0, [4, 3], 1, 1], ["AN", 3, 1, 6], ["FU", 1, [0, 1]], ["SP", 1, 0, 32, [1], 1], ["AN", 1, 1, 2], ["FFSP", 1, 0, [4, 3], 1, 1], ["AN", 1, 1, 6], ["PR", 4, 0, "auto_unroll_max_step$64"]]]], "r": [[0.176802, 0.176945, 0.176562], 0, 2.66895, 1608111902], "v": "v0.4"}
{"i": [["[\"swish_gemm\", 128, 3072, 768]", "metal -keys=metal,gpu -max_num_threads=1024", [-1, 16, 64, 32768, 2147483647, 1024, 2, 8]], [[], [["CI", 4], ["CI", 3], ["CHW", 2, "local"], ["SP", 2, 0, 128, [2, 1, 16, 2], 1], ["SP", 2, 5, 3072, [1, 24, 1, 4], 1], ["SP", 2, 10, 768, [2, 1], 1], ["RE", 2, [0, 5, 1, 6, 2, 7, 10, 11, 3, 8, 12, 4, 9]], ["FSP", 3, 0, 3, 3], ["FSP", 3, 4, 4, 3], ["RE", 3, [0, 4, 1, 5, 2, 6, 3, 7]], ["CA", 2, 3, 5], ["CHR", 1, "shared", [2]], ["CA", 2, 3, 6], ["CHR", 0, "shared", [3]], ["CA", 1, 4, 6], ["FU", 8, [0, 1]], ["SP", 8, 0, 393216, [8], 1], ["AN", 8, 0, 5], ["AN", 8, 1, 6], ["FU", 5, [0, 1]], ["AN", 5, 0, 5], ["FU", 5, [1, 2]], ["AN", 5, 1, 4], ["FU", 5, [2, 3]], ["AN", 5, 2, 6], ["FU", 3, [0, 1]], ["SP", 3, 0, 8, [1], 1], ["AN", 3, 1, 2], ["FFSP", 3, 0, [4, 3], 1, 1], ["AN", 3, 1, 6], ["FU", 1, [0, 1]], ["SP", 1, 0, 128, [1], 1], ["AN", 1, 1, 2], ["FFSP", 1, 0, [4, 3], 1, 1], ["AN", 1, 1, 6], ["PR", 4, 0, "auto_unroll_max_step$512"]]]], "r": [[0.0430281, 0.0429872, 0.0425373], 0, 2.57178, 1608111905], "v": "v0.4"}
{"i": [["[\"swish_gemm\", 128, 3072, 768]", "metal -keys=metal,gpu -max_num_threads=1024", [-1, 16, 64, 32768, 2147483647, 1024, 2, 8]], [[], [["CI", 4], ["CI", 3], ["CHW", 2, "local"], ["SP", 2, 0, 128, [2, 1, 16, 1], 1], ["SP", 2, 5, 3072, [1, 96, 32, 1], 1], ["SP", 2, 10, 768, [2, 1], 1], ["RE", 2, [0, 5, 1, 6, 2, 7, 10, 11, 3, 8, 12, 4, 9]], ["FSP", 3, 0, 3, 3], ["FSP", 3, 4, 4, 3], ["RE", 3, [0, 4, 1, 5, 2, 6, 3, 7]], ["CA", 2, 3, 5], ["CHR", 1, "shared", [2]], ["CA", 2, 3, 6], ["CHR", 0, "shared", [3]], ["CA", 1, 4, 6], ["FU", 8, [0, 1]], ["SP", 8, 0, 393216, [8], 1], ["AN", 8, 0, 5], ["AN", 8, 1, 6], ["FU", 5, [0, 1]], ["AN", 5, 0, 5], ["FU", 5, [1, 2]], ["AN", 5, 1, 4], ["FU", 5, [2, 3]], ["AN", 5, 2, 6], ["FU", 3, [0, 1]], ["SP", 3, 0, 64, [1], 1], ["AN", 3, 1, 2], ["FFSP", 3, 0, [4, 3], 1, 1], ["AN", 3, 1, 6], ["FU", 1, [0, 1]], ["SP", 1, 0, 256, [1], 1], ["AN", 1, 1, 2], ["FFSP", 1, 0, [4, 3], 1, 1], ["AN", 1, 1, 6], ["PR", 4, 0, "auto_unroll_max_step$0"]]]], "r": [[0.0327796, 0.0327384, 0.0325966], 0, 2.05423, 1608111907], "v": "v0.4"}
{"i": [["[\"swish_gemm\", 128, 3072, 768]", "metal -keys=metal,gpu -max_num_threads=1024", [-1, 16, 64, 32768, 2147483647, 1024, 2, 8]], [[], [["CI", 4], ["CI", 3], ["CHW", 2, "local"], ["SP", 2, 0, 128, [1, 64, 1, 2], 1], ["SP", 2, 5, 3072, [1, 1, 32, 2], 1], ["SP", 2, 10, 768, [1, 6], 1], ["RE", 2, [0, 5, 1, 6, 2, 7, 10, 11, 3, 8, 12, 4, 9]], ["FSP", 3, 0, 3, 3], ["FSP", 3, 4, 4, 3], ["RE", 3, [0, 4, 1, 5, 2, 6, 3, 7]], ["CA", 2, 3, 5], ["CHR", 1, "shared", [2]], ["CA", 2, 3, 6], ["CHR", 0, "shared", [3]], ["CA", 1, 4, 6], ["FU", 8, [0, 1]], ["SP", 8, 0, 393216, [8], 1], ["AN", 8, 0, 5], ["AN", 8, 1, 6], ["FU", 5, [0, 1]], ["AN", 5, 0, 5], ["FU", 5, [1, 2]], ["AN", 5, 1, 4], ["FU", 5, [2, 3]], ["AN", 5, 2, 6], ["FU", 3, [0, 1]], ["SP", 3, 0, 1536, [1], 1], ["AN", 3, 1, 2], ["FFSP", 3, 0, [4, 3], 1, 1], ["AN", 3, 1, 6], ["FU", 1, [0, 1]], ["SP", 1, 0, 48, [1], 1], ["AN", 1, 1, 2], ["FFSP", 1, 0, [4, 3], 1, 1], ["AN", 1, 1, 6], ["PR", 4, 0, "auto_unroll_max_step$0"]]]], "r": [[0.00458272, 0.00457669, 0.00457844], 0, 2.26236, 1608111909], "v": "v0.4"}
{"i": [["[\"swish_gemm\", 128, 3072, 768]", "metal -keys=metal,gpu -max_num_threads=1024", [-1, 16, 64, 32768, 2147483647, 1024, 2, 8]], [[], [["CI", 4], ["CI", 3], ["CHW", 2, "local"], ["SP", 2, 0, 128, [2, 1, 2, 2], 1], ["SP", 2, 5, 3072, [1, 16, 1, 4], 1], ["SP", 2, 10, 768, [64, 1], 1], ["RE", 2, [0, 5, 1, 6, 2, 7, 10, 11, 3, 8, 12, 4, 9]], ["FSP", 3, 0, 3, 3], ["FSP", 3, 4, 4, 3], ["RE", 3, [0, 4, 1, 5, 2, 6, 3, 7]], ["CA", 2, 3, 5], ["CHR", 1, "shared", [2]], ["CA", 2, 3, 6], ["CHR", 0, "shared", [3]], ["CA", 1, 4, 6], ["FU", 8, [0, 1]], ["SP", 8, 0, 393216, [48], 1], ["AN", 8, 0, 5], ["AN", 8, 1, 6], ["FU", 5, [0, 1]], ["AN", 5, 0, 5], ["FU", 5, [1, 2]], ["AN", 5, 1, 4], ["FU", 5, [2, 3]], ["AN", 5, 2, 6], ["FU", 3, [0, 1]], ["SP", 3, 0, 256, [1], 1], ["AN", 3, 1, 2], ["FFSP", 3, 0, [4, 3], 1, 1], ["AN", 3, 1, 6], ["FU", 1, [0, 1]], ["SP", 1, 0, 256, [1], 1], ["AN", 1, 1, 2], ["FFSP", 1, 0, [4, 3], 1, 1], ["AN", 1, 1, 6], ["PR", 4, 0, "auto_unroll_max_step$0"]]]], "r": [[0.00983136, 0.00982537, 0.00983149], 0, 2.59942, 1608111912], "v": "v0.4"}
{"i": [["[\"swish_gemm\", 128, 3072, 768]", "metal -keys=metal,gpu -max_num_threads=1024", [-1, 16, 64, 32768, 2147483647, 1024, 2, 8]], [[], [["CI", 4], ["CI", 3], ["CHW", 2, "local"], ["SP", 2, 0, 128, [2, 1, 32, 1], 1], ["SP", 2, 5, 3072, [1, 96, 4, 1], 1], ["SP", 2, 10, 768, [16, 1], 1], ["RE", 2, [0, 5, 1, 6, 2, 7, 10, 11, 3, 8, 12, 4, 9]], ["FSP", 3, 0, 3, 3], ["FSP", 3, 4, 4, 3], ["RE", 3, [0, 4, 1, 5, 2, 6, 3, 7]], ["CA", 2, 3, 5], ["CHR", 1, "shared", [2]], ["CA", 2, 3, 6], ["CHR", 0, "shared", [3]], ["CA", 1, 4, 6], ["FU", 8, [0, 1]], ["SP", 8, 0, 393216, [8], 1], ["AN", 8, 0, 5], ["AN", 8, 1, 6], ["FU", 5, [0, 1]], ["AN", 5, 0, 5], ["FU", 5, [1, 2]], ["AN", 5, 1, 4], ["FU", 5, [2, 3]], ["AN", 5, 2, 6], ["FU", 3, [0, 1]], ["SP", 3, 0, 64, [1], 1], ["AN", 3, 1, 2], ["FFSP", 3, 0, [4, 3], 1, 1], ["AN", 3, 1, 6], ["FU", 1, [0, 1]], ["SP", 1, 0, 256, [1], 1], ["AN", 1, 1, 2], ["FFSP", 1, 0, [4, 3], 1, 1], ["AN", 1, 1, 6], ["PR", 4, 0, "auto_unroll_max_step$0"]]]], "r": [[0.0120575, 0.0120478, 0.012012], 0, 2.05614, 1608111915], "v": "v0.4"}
{"i": [["[\"swish_gemm\", 128, 3072, 768]", "metal -keys=metal,gpu -max_num_threads=1024", [-1, 16, 64, 32768, 2147483647, 1024, 2, 8]], [[], [["CI", 4], ["CI", 3], ["CHW", 2, "local"], ["SP", 2, 0, 128, [1, 8, 4, 1], 1], ["SP", 2, 5, 3072, [1, 1, 1, 32], 1], ["SP", 2, 10, 768, [1, 4], 1], ["RE", 2, [0, 5, 1, 6, 2, 7, 10, 11, 3, 8, 12, 4, 9]], ["FSP", 3, 0, 3, 3], ["FSP", 3, 4, 4, 3], ["RE", 3, [0, 4, 1, 5, 2, 6, 3, 7]], ["CA", 2, 3, 5], ["CHR", 1, "shared", [2]], ["CA", 2, 3, 6], ["CHR", 0, "shared", [3]], ["CA", 1, 4, 6], ["FU", 8, [0, 1]], ["SP", 8, 0, 393216, [8], 1], ["AN", 8, 0, 5], ["AN", 8, 1, 6], ["FU", 5, [0, 1]], ["AN", 5, 0, 5], ["FU", 5, [1, 2]], ["AN", 5, 1, 4], ["FU", 5, [2, 3]], ["AN", 5, 2, 6], ["FU", 3, [0, 1]], ["SP", 3, 0, 64, [1], 1], ["AN", 3, 1, 2], ["FFSP", 3, 0, [4, 3], 1, 1], ["AN", 3, 1, 6], ["FU", 1, [0, 1]], ["SP", 1, 0, 16, [1], 1], ["AN", 1, 1, 2], ["FFSP", 1, 0, [4, 3], 1, 1], ["AN", 1, 1, 6], ["PR", 4, 0, "auto_unroll_max_step$0"]]]], "r": [[0.0157017, 0.0156986, 0.0156829], 0, 1.98148, 1608111917], "v": "v0.4"}
{"i": [["[\"swish_gemm\", 128, 3072, 768]", "metal -keys=metal,gpu -max_num_threads=1024", [-1, 16, 64, 32768, 2147483647, 1024, 2, 8]], [[], [["CI", 4], ["CI", 3], ["CHW", 2, "local"], ["SP", 2, 0, 128, [1, 64, 2, 1], 1], ["SP", 2, 5, 3072, [1, 1, 32, 2], 1], ["SP", 2, 10, 768, [3, 8], 1], ["RE", 2, [0, 5, 1, 6, 2, 7, 10, 11, 3, 8, 12, 4, 9]], ["FSP", 3, 0, 3, 3], ["FSP", 3, 4, 4, 3], ["RE", 3, [0, 4, 1, 5, 2, 6, 3, 7]], ["CA", 2, 3, 5], ["CHR", 1, "shared", [2]], ["CA", 2, 3, 6], ["CHR", 0, "shared", [3]], ["CA", 1, 4, 6], ["FU", 8, [0, 1]], ["SP", 8, 0, 393216, [8], 1], ["AN", 8, 0, 5], ["AN", 8, 1, 6], ["FU", 5, [0, 1]], ["AN", 5, 0, 5], ["FU", 5, [1, 2]], ["AN", 5, 1, 4], ["FU", 5, [2, 3]], ["AN", 5, 2, 6], ["FU", 3, [0, 1]], ["SP", 3, 0, 1536, [1], 1], ["AN", 3, 1, 2], ["FFSP", 3, 0, [4, 3], 1, 1], ["AN", 3, 1, 6], ["FU", 1, [0, 1]], ["SP", 1, 0, 48, [1], 1], ["AN", 1, 1, 2], ["FFSP", 1, 0, [4, 3], 1, 1], ["AN", 1, 1, 6], ["PR", 4, 0, "auto_unroll_max_step$0"]]]], "r": [[0.00385831, 0.00384151, 0.00386131], 0, 2.74076, 1608111920], "v": "v0.4"}
{"i": [["[\"swish_gemm\", 128, 3072, 768]", "metal -keys=metal,gpu -max_num_threads=1024", [-1, 16, 64, 32768, 2147483647, 1024, 2, 8]], [[], [["CI", 4], ["CI", 3], ["CHW", 2, "local"], ["SP", 2, 0, 128, [1, 8, 1, 2], 1], ["SP", 2, 5, 3072, [1, 4, 32, 1], 1], ["SP", 2, 10, 768, [1, 48], 1], ["RE", 2, [0, 5, 1, 6, 2, 7, 10, 11, 3, 8, 12, 4, 9]], ["FSP", 3, 0, 3, 3], ["FSP", 3, 4, 4, 3], ["RE", 3, [0, 4, 1, 5, 2, 6, 3, 7]], ["CA", 2, 3, 5], ["CHR", 1, "shared", [2]], ["CA", 2, 3, 6], ["CHR", 0, "shared", [3]], ["CA", 1, 4, 6], ["FU", 8, [0, 1]], ["SP", 8, 0, 393216, [8], 1], ["AN", 8, 0, 5], ["AN", 8, 1, 6], ["FU", 5, [0, 1]], ["AN", 5, 0, 5], ["FU", 5, [1, 2]], ["AN", 5, 1, 4], ["FU", 5, [2, 3]], ["AN", 5, 2, 6], ["FU", 3, [0, 1]], ["SP", 3, 0, 192, [1], 1], ["AN", 3, 1, 2], ["FFSP", 3, 0, [4, 3], 1, 1], ["AN", 3, 1, 6], ["FU", 1, [0, 1]], ["SP", 1, 0, 6, [1], 1], ["AN", 1, 1, 2], ["FFSP", 1, 0, [4, 3], 1, 1], ["AN", 1, 1, 6], ["PR", 4, 0, "auto_unroll_max_step$512"]]]], "r": [[0.0118322, 0.0118398, 0.0118222], 0, 2.15185, 1608111922], "v": "v0.4"}
{"i": [["[\"swish_gemm\", 128, 3072, 768]", "metal -keys=metal,gpu -max_num_threads=1024", [-1, 16, 64, 32768, 2147483647, 1024, 2, 8]], [[], [["CI", 4], ["CI", 3], ["CHW", 2, "local"], ["SP", 2, 0, 128, [1, 4, 1, 2], 1], ["SP", 2, 5, 3072, [1, 2, 8, 12], 1], ["SP", 2, 10, 768, [12, 1], 1], ["RE", 2, [0, 5, 1, 6, 2, 7, 10, 11, 3, 8, 12, 4, 9]], ["FSP", 3, 0, 3, 3], ["FSP", 3, 4, 4, 3], ["RE", 3, [0, 4, 1, 5, 2, 6, 3, 7]], ["CA", 2, 3, 5], ["CHR", 1, "shared", [2]], ["CA", 2, 3, 6], ["CHR", 0, "shared", [3]], ["CA", 1, 4, 6], ["FU", 8, [0, 1]], ["SP", 8, 0, 393216, [8], 1], ["AN", 8, 0, 5], ["AN", 8, 1, 6], ["FU", 5, [0, 1]], ["AN", 5, 0, 5], ["FU", 5, [1, 2]], ["AN", 5, 1, 4], ["FU", 5, [2, 3]], ["AN", 5, 2, 6], ["FU", 3, [0, 1]], ["SP", 3, 0, 1152, [1], 1], ["AN", 3, 1, 2], ["FFSP", 3, 0, [4, 3], 1, 1], ["AN", 3, 1, 6], ["FU", 1, [0, 1]], ["SP", 1, 0, 24, [1], 1], ["AN", 1, 1, 2], ["FFSP", 1, 0, [4, 3], 1, 1], ["AN", 1, 1, 6], ["PR", 4, 0, "auto_unroll_max_step$512"]]]], "r": [[0.174049, 0.168382, 0.167885], 0, 3.16106, 1608111929], "v": "v0.4"}
{"i": [["[\"swish_gemm\", 128, 3072, 768]", "metal -keys=metal,gpu -max_num_threads=1024", [-1, 16, 64, 32768, 2147483647, 1024, 2, 8]], [[], [["CI", 4], ["CI", 3], ["CHW", 2, "local"], ["SP", 2, 0, 128, [8, 4, 1, 2], 1], ["SP", 2, 5, 3072, [1, 2, 2, 8], 1], ["SP", 2, 10, 768, [4, 3], 1], ["RE", 2, [0, 5, 1, 6, 2, 7, 10, 11, 3, 8, 12, 4, 9]], ["FSP", 3, 0, 3, 3], ["FSP", 3, 4, 4, 3], ["RE", 3, [0, 4, 1, 5, 2, 6, 3, 7]], ["CA", 2, 3, 5], ["CHR", 1, "shared", [2]], ["CA", 2, 3, 6], ["CHR", 0, "shared", [3]], ["CA", 1, 4, 6], ["FU", 8, [0, 1]], ["SP", 8, 0, 393216, [8], 1], ["AN", 8, 0, 5], ["AN", 8, 1, 6], ["FU", 5, [0, 1]], ["AN", 5, 0, 5], ["FU", 5, [1, 2]], ["AN", 5, 1, 4], ["FU", 5, [2, 3]], ["AN", 5, 2, 6], ["FU", 3, [0, 1]], ["SP", 3, 0, 192, [4], 1], ["AN", 3, 1, 2], ["FFSP", 3, 0, [4, 3], 1, 1], ["AN", 3, 1, 6], ["FU", 1, [0, 1]], ["SP", 1, 0, 24, [2], 1], ["AN", 1, 1, 2], ["FFSP", 1, 0, [4, 3], 1, 1], ["AN", 1, 1, 6], ["PR", 4, 0, "auto_unroll_max_step$0"]]]], "r": [[0.0166856, 0.0167137, 0.0167037], 0, 2.63531, 1608111933], "v": "v0.4"}
{"i": [["[\"swish_gemm\", 128, 3072, 768]", "metal -keys=metal,gpu -max_num_threads=1024", [-1, 16, 64, 32768, 2147483647, 1024, 2, 8]], [[], [["CI", 4], ["CI", 3], ["CHW", 2, "local"], ["SP", 2, 0, 128, [2, 2, 4, 2], 1], ["SP", 2, 5, 3072, [1, 12, 2, 1], 1], ["SP", 2, 10, 768, [8, 1], 1], ["RE", 2, [0, 5, 1, 6, 2, 7, 10, 11, 3, 8, 12, 4, 9]], ["FSP", 3, 0, 3, 3], ["FSP", 3, 4, 4, 3], ["RE", 3, [0, 4, 1, 5, 2, 6, 3, 7]], ["CA", 2, 3, 5], ["CHR", 1, "shared", [2]], ["CA", 2, 3, 6], ["CHR", 0, "shared", [3]], ["CA", 1, 4, 6], ["FU", 8, [0, 1]], ["SP", 8, 0, 393216, [1], 1], ["AN", 8, 0, 5], ["AN", 8, 1, 6], ["FU", 5, [0, 1]], ["AN", 5, 0, 5], ["FU", 5, [1, 2]], ["AN", 5, 1, 4], ["FU", 5, [2, 3]], ["AN", 5, 2, 6], ["FU", 3, [0, 1]], ["SP", 3, 0, 16, [1], 1], ["AN", 3, 1, 2], ["FFSP", 3, 0, [4, 3], 1, 1], ["AN", 3, 1, 6], ["FU", 1, [0, 1]], ["SP", 1, 0, 64, [1], 1], ["AN", 1, 1, 2], ["FFSP", 1, 0, [4, 3], 1, 1], ["AN", 1, 1, 6], ["PR", 4, 0, "auto_unroll_max_step$16"]]]], "r": [[0.00183462, 0.00183962, 0.00184105], 0, 1.93096, 1608111940], "v": "v0.4"}
{"i": [["[\"swish_gemm\", 128, 3072, 768]", "metal -keys=metal,gpu -max_num_threads=1024", [-1, 16, 64, 32768, 2147483647, 1024, 2, 8]], [[], [["CI", 4], ["CI", 3], ["CHW", 2, "local"], ["SP", 2, 0, 128, [1, 32, 2, 1], 1], ["SP", 2, 5, 3072, [1, 12, 32, 1], 1], ["SP", 2, 10, 768, [1, 1], 1], ["RE", 2, [0, 5, 1, 6, 2, 7, 10, 11, 3, 8, 12, 4, 9]], ["FSP", 3, 0, 3, 3], ["FSP", 3, 4, 4, 3], ["RE", 3, [0, 4, 1, 5, 2, 6, 3, 7]], ["CA", 2, 3, 5], ["CHR", 1, "shared", [2]], ["CA", 2, 3, 6], ["CHR", 0, "shared", [3]], ["CA", 1, 4, 6], ["FU", 8, [0, 1]], ["SP", 8, 0, 393216, [8], 1], ["AN", 8, 0, 5], ["AN", 8, 1, 6], ["FU", 5, [0, 1]], ["AN", 5, 0, 5], ["FU", 5, [1, 2]], ["AN", 5, 1, 4], ["FU", 5, [2, 3]], ["AN", 5, 2, 6], ["FU", 3, [0, 1]], ["SP", 3, 0, 128, [1], 1], ["AN", 3, 1, 2], ["FFSP", 3, 0, [4, 3], 1, 1], ["AN", 3, 1, 6], ["FU", 1, [0, 1]], ["SP", 1, 0, 32, [1], 1], ["AN", 1, 1, 2], ["FFSP", 1, 0, [4, 3], 1, 1], ["AN", 1, 1, 6], ["PR", 4, 0, "auto_unroll_max_step$64"]]]], "r": [[0.00276406, 0.00276555, 0.0027665], 0, 2.03533, 1608111942], "v": "v0.4"}
{"i": [["[\"swish_gemm\", 128, 3072, 768]", "metal -keys=metal,gpu -max_num_threads=1024", [-1, 16, 64, 32768, 2147483647, 1024, 2, 8]], [[], [["CI", 4], ["CI", 3], ["CHW", 2, "local"], ["SP", 2, 0, 128, [1, 16, 1, 4], 1], ["SP", 2, 5, 3072, [1, 8, 1, 12], 1], ["SP", 2, 10, 768, [4, 3], 1], ["RE", 2, [0, 5, 1, 6, 2, 7, 10, 11, 3, 8, 12, 4, 9]], ["FSP", 3, 0, 3, 3], ["FSP", 3, 4, 4, 3], ["RE", 3, [0, 4, 1, 5, 2, 6, 3, 7]], ["CA", 2, 3, 5], ["CHR", 1, "shared", [2]], ["CA", 2, 3, 6], ["CHR", 0, "shared", [3]], ["CA", 1, 4, 6], ["FU", 8, [0, 1]], ["SP", 8, 0, 393216, [8], 1], ["AN", 8, 0, 5], ["AN", 8, 1, 6], ["FU", 5, [0, 1]], ["AN", 5, 0, 5], ["FU", 5, [1, 2]], ["AN", 5, 1, 4], ["FU", 5, [2, 3]], ["AN", 5, 2, 6], ["FU", 3, [0, 1]], ["SP", 3, 0, 144, [1], 1], ["AN", 3, 1, 2], ["FFSP", 3, 0, [4, 3], 1, 1], ["AN", 3, 1, 6], ["FU", 1, [0, 1]], ["SP", 1, 0, 96, [1], 1], ["AN", 1, 1, 2], ["FFSP", 1, 0, [4, 3], 1, 1], ["AN", 1, 1, 6], ["PR", 4, 0, "auto_unroll_max_step$64"]]]], "r": [[0.00108487, 0.00108441, 0.00108395], 0, 2.74146, 1608111945], "v": "v0.4"}
{"i": [["[\"swish_gemm\", 128, 3072, 768]", "metal -keys=metal,gpu -max_num_threads=1024", [-1, 16, 64, 32768, 2147483647, 1024, 2, 8]], [[], [["CI", 4], ["CI", 3], ["CHW", 2, "local"], ["SP", 2, 0, 128, [2, 1, 1, 16], 1], ["SP", 2, 5, 3072, [1, 16, 3, 2], 1], ["SP", 2, 10, 768, [16, 4], 1], ["RE", 2, [0, 5, 1, 6, 2, 7, 10, 11, 3, 8, 12, 4, 9]], ["FSP", 3, 0, 3, 3], ["FSP", 3, 4, 4, 3], ["RE", 3, [0, 4, 1, 5, 2, 6, 3, 7]], ["CA", 2, 3, 5], ["CHR", 1, "shared", [2]], ["CA", 2, 3, 6], ["CHR", 0, "shared", [3]], ["CA", 1, 4, 6], ["FU", 8, [0, 1]], ["SP", 8, 0, 393216, [8], 1], ["AN", 8, 0, 5], ["AN", 8, 1, 6], ["FU", 5, [0, 1]], ["AN", 5, 0, 5], ["FU", 5, [1, 2]], ["AN", 5, 1, 4], ["FU", 5, [2, 3]], ["AN", 5, 2, 6], ["FU", 3, [0, 1]], ["SP", 3, 0, 384, [1], 1], ["AN", 3, 1, 2], ["FFSP", 3, 0, [4, 3], 1, 1], ["AN", 3, 1, 6], ["FU", 1, [0, 1]], ["SP", 1, 0, 1024, [1], 1], ["AN", 1, 1, 2], ["FFSP", 1, 0, [4, 3], 1, 1], ["AN", 1, 1, 6], ["PR", 4, 0, "auto_unroll_max_step$64"]]]], "r": [[0.0380498, 0.0376822, 0.0376697], 0, 2.63043, 1608111948], "v": "v0.4"}
{"i": [["[\"swish_gemm\", 128, 3072, 768]", "metal -keys=metal,gpu -max_num_threads=1024", [-1, 16, 64, 32768, 2147483647, 1024, 2, 8]], [[], [["CI", 4], ["CI", 3], ["CHW", 2, "local"], ["SP", 2, 0, 128, [1, 16, 8, 1], 1], ["SP", 2, 5, 3072, [1, 1, 4, 24], 1], ["SP", 2, 10, 768, [3, 1], 1], ["RE", 2, [0, 5, 1, 6, 2, 7, 10, 11, 3, 8, 12, 4, 9]], ["FSP", 3, 0, 3, 3], ["FSP", 3, 4, 4, 3], ["RE", 3, [0, 4, 1, 5, 2, 6, 3, 7]], ["CA", 2, 3, 5], ["CHR", 1, "shared", [2]], ["CA", 2, 3, 6], ["CHR", 0, "shared", [3]], ["CA", 1, 4, 6], ["FU", 8, [0, 1]], ["SP", 8, 0, 393216, [8], 1], ["AN", 8, 0, 5], ["AN", 8, 1, 6], ["FU", 5, [0, 1]], ["AN", 5, 0, 5], ["FU", 5, [1, 2]], ["AN", 5, 1, 4], ["FU", 5, [2, 3]], ["AN", 5, 2, 6], ["FU", 3, [0, 1]], ["SP", 3, 0, 288, [1], 1], ["AN", 3, 1, 2], ["FFSP", 3, 0, [4, 3], 1, 1], ["AN", 3, 1, 6], ["FU", 1, [0, 1]], ["SP", 1, 0, 6, [1], 1], ["AN", 1, 1, 2], ["FFSP", 1, 0, [4, 3], 1, 1], ["AN", 1, 1, 6], ["PR", 4, 0, "auto_unroll_max_step$512"]]]], "r": [[0.036155, 0.0362182, 0.0361688], 0, 2.2731, 1608111951], "v": "v0.4"}
{"i": [["[\"swish_gemm\", 128, 3072, 768]", "metal -keys=metal,gpu -max_num_threads=1024", [-1, 16, 64, 32768, 2147483647, 1024, 2, 8]], [[], [["CI", 4], ["CI", 3], ["CHW", 2, "local"], ["SP", 2, 0, 128, [2, 1, 1, 16], 1], ["SP", 2, 5, 3072, [1, 16, 3, 2], 1], ["SP", 2, 10, 768, [16, 4], 1], ["RE", 2, [0, 5, 1, 6, 2, 7, 10, 11, 3, 8, 12, 4, 9]], ["FSP", 3, 0, 3, 3], ["FSP", 3, 4, 4, 3], ["RE", 3, [0, 4, 1, 5, 2, 6, 3, 7]], ["CA", 2, 3, 5], ["CHR", 1, "shared", [2]], ["CA", 2, 3, 6], ["CHR", 0, "shared", [3]], ["CA", 1, 4, 6], ["FU", 8, [0, 1]], ["SP", 8, 0, 393216, [1], 1], ["AN", 8, 0, 5], ["AN", 8, 1, 6], ["FU", 5, [0, 1]], ["AN", 5, 0, 5], ["FU", 5, [1, 2]], ["AN", 5, 1, 4], ["FU", 5, [2, 3]], ["AN", 5, 2, 6], ["FU", 3, [0, 1]], ["SP", 3, 0, 384, [1], 1], ["AN", 3, 1, 2], ["FFSP", 3, 0, [4, 3], 1, 1], ["AN", 3, 1, 6], ["FU", 1, [0, 1]], ["SP", 1, 0, 1024, [1], 1], ["AN", 1, 1, 2], ["FFSP", 1, 0, [4, 3], 1, 1], ["AN", 1, 1, 6], ["PR", 4, 0, "auto_unroll_max_step$16"]]]], "r": [[0.0418592, 0.0422744, 0.0418248], 0, 2.1345, 1608111953], "v": "v0.4"}
{"i": [["[\"swish_gemm\", 128, 3072, 768]", "metal -keys=metal,gpu -max_num_threads=1024", [-1, 16, 64, 32768, 2147483647, 1024, 2, 8]], [[], [["CI", 4], ["CI", 3], ["CHW", 2, "local"], ["SP", 2, 0, 128, [2, 2, 4, 2], 1], ["SP", 2, 5, 3072, [1, 384, 2, 1], 1], ["SP", 2, 10, 768, [8, 1], 1], ["RE", 2, [0, 5, 1, 6, 2, 7, 10, 11, 3, 8, 12, 4, 9]], ["FSP", 3, 0, 3, 3], ["FSP", 3, 4, 4, 3], ["RE", 3, [0, 4, 1, 5, 2, 6, 3, 7]], ["CA", 2, 3, 5], ["CHR", 1, "shared", [2]], ["CA", 2, 3, 6], ["CHR", 0, "shared", [3]], ["CA", 1, 4, 6], ["FU", 8, [0, 1]], ["SP", 8, 0, 393216, [8], 1], ["AN", 8, 0, 5], ["AN", 8, 1, 6], ["FU", 5, [0, 1]], ["AN", 5, 0, 5], ["FU", 5, [1, 2]], ["AN", 5, 1, 4], ["FU", 5, [2, 3]], ["AN", 5, 2, 6], ["FU", 3, [0, 1]], ["SP", 3, 0, 16, [1], 1], ["AN", 3, 1, 2], ["FFSP", 3, 0, [4, 3], 1, 1], ["AN", 3, 1, 6], ["FU", 1, [0, 1]], ["SP", 1, 0, 64, [1], 1], ["AN", 1, 1, 2], ["FFSP", 1, 0, [4, 3], 1, 1], ["AN", 1, 1, 6], ["PR", 4, 0, "auto_unroll_max_step$0"]]]], "r": [[0.00164317, 0.00164006, 0.00164507], 0, 2.75448, 1608111956], "v": "v0.4"}
{"i": [["[\"swish_gemm\", 128, 3072, 768]", "metal -keys=metal,gpu -max_num_threads=1024", [-1, 16, 64, 32768, 2147483647, 1024, 2, 8]], [[], [["CI", 4], ["CI", 3], ["CHW", 2, "local"], ["SP", 2, 0, 128, [1, 1, 2, 4], 1], ["SP", 2, 5, 3072, [2, 12, 2, 4], 1], ["SP", 2, 10, 768, [6, 2], 1], ["RE", 2, [0, 5, 1, 6, 2, 7, 10, 11, 3, 8, 12, 4, 9]], ["FSP", 3, 0, 3, 3], ["FSP", 3, 4, 4, 3], ["RE", 3, [0, 4, 1, 5, 2, 6, 3, 7]], ["CA", 2, 3, 5], ["CHR", 1, "shared", [2]], ["CA", 2, 3, 6], ["CHR", 0, "shared", [3]], ["CA", 1, 4, 6], ["FU", 8, [0, 1]], ["SP", 8, 0, 393216, [8], 1], ["AN", 8, 0, 5], ["AN", 8, 1, 6], ["FU", 5, [0, 1]], ["AN", 5, 0, 5], ["FU", 5, [1, 2]], ["AN", 5, 1, 4], ["FU", 5, [2, 3]], ["AN", 5, 2, 6], ["FU", 3, [0, 1]], ["SP", 3, 0, 192, [1], 1], ["AN", 3, 1, 2], ["FFSP", 3, 0, [4, 3], 1, 1], ["AN", 3, 1, 6], ["FU", 1, [0, 1]], ["SP", 1, 0, 96, [4], 1], ["AN", 1, 1, 2], ["FFSP", 1, 0, [4, 3], 1, 1], ["AN", 1, 1, 6], ["PR", 4, 0, "auto_unroll_max_step$512"]]]], "r": [[0.0316038, 0.0315634, 0.0316892], 0, 2.22444, 1608111959], "v": "v0.4"}
{"i": [["[\"swish_gemm\", 128, 3072, 768]", "metal -keys=metal,gpu -max_num_threads=1024", [-1, 16, 64, 32768, 2147483647, 1024, 2, 8]], [[], [["CI", 4], ["CI", 3], ["CHW", 2, "local"], ["SP", 2, 0, 128, [1, 8, 4, 1], 1], ["SP", 2, 5, 3072, [2, 1, 1, 16], 1], ["SP", 2, 10, 768, [1, 48], 1], ["RE", 2, [0, 5, 1, 6, 2, 7, 10, 11, 3, 8, 12, 4, 9]], ["FSP", 3, 0, 3, 3], ["FSP", 3, 4, 4, 3], ["RE", 3, [0, 4, 1, 5, 2, 6, 3, 7]], ["CA", 2, 3, 5], ["CHR", 1, "shared", [2]], ["CA", 2, 3, 6], ["CHR", 0, "shared", [3]], ["CA", 1, 4, 6], ["FU", 8, [0, 1]], ["SP", 8, 0, 393216, [8], 1], ["AN", 8, 0, 5], ["AN", 8, 1, 6], ["FU", 5, [0, 1]], ["AN", 5, 0, 5], ["FU", 5, [1, 2]], ["AN", 5, 1, 4], ["FU", 5, [2, 3]], ["AN", 5, 2, 6], ["FU", 3, [0, 1]], ["SP", 3, 0, 64, [1], 1], ["AN", 3, 1, 2], ["FFSP", 3, 0, [4, 3], 1, 1], ["AN", 3, 1, 6], ["FU", 1, [0, 1]], ["SP", 1, 0, 16, [1], 1], ["AN", 1, 1, 2], ["FFSP", 1, 0, [4, 3], 1, 1], ["AN", 1, 1, 6], ["PR", 4, 0, "auto_unroll_max_step$0"]]]], "r": [[0.0241433, 0.0241181, 0.0241702], 0, 1.80268, 1608111961], "v": "v0.4"}
{"i": [["[\"swish_gemm\", 128, 3072, 768]", "metal -keys=metal,gpu -max_num_threads=1024", [-1, 16, 64, 32768, 2147483647, 1024, 2, 8]], [[], [["CI", 4], ["CI", 3], ["CHW", 2, "local"], ["SP", 2, 0, 128, [1, 4, 2, 8], 1], ["SP", 2, 5, 3072, [1, 12, 32, 2], 1], ["SP", 2, 10, 768, [2, 1], 1], ["RE", 2, [0, 5, 1, 6, 2, 7, 10, 11, 3, 8, 12, 4, 9]], ["FSP", 3, 0, 3, 3], ["FSP", 3, 4, 4, 3], ["RE", 3, [0, 4, 1, 5, 2, 6, 3, 7]], ["CA", 2, 3, 5], ["CHR", 1, "shared", [2]], ["CA", 2, 3, 6], ["CHR", 0, "shared", [3]], ["CA", 1, 4, 6], ["FU", 8, [0, 1]], ["SP", 8, 0, 393216, [1], 1], ["AN", 8, 0, 5], ["AN", 8, 1, 6], ["FU", 5, [0, 1]], ["AN", 5, 0, 5], ["FU", 5, [1, 2]], ["AN", 5, 1, 4], ["FU", 5, [2, 3]], ["AN", 5, 2, 6], ["FU", 3, [0, 1]], ["SP", 3, 0, 128, [1], 1], ["AN", 3, 1, 2], ["FFSP", 3, 0, [4, 3], 1, 1], ["AN", 3, 1, 6], ["FU", 1, [0, 1]], ["SP", 1, 0, 32, [1], 1], ["AN", 1, 1, 2], ["FFSP", 1, 0, [4, 3], 1, 1], ["AN", 1, 1, 6], ["PR", 4, 0, "auto_unroll_max_step$64"]]]], "r": [[0.0843235, 0.0841802, 0.0843238], 0, 2.17949, 1608111963], "v": "v0.4"}
{"i": [["[\"swish_gemm\", 128, 3072, 768]", "metal -keys=metal,gpu -max_num_threads=1024", [-1, 16, 64, 32768, 2147483647, 1024, 2, 8]], [[], [["CI", 4], ["CI", 3], ["CHW", 2, "local"], ["SP", 2, 0, 128, [1, 8, 1, 1], 1], ["SP", 2, 5, 3072, [1, 6, 8, 16], 1], ["SP", 2, 10, 768, [4, 1], 1], ["RE", 2, [0, 5, 1, 6, 2, 7, 10, 11, 3, 8, 12, 4, 9]], ["FSP", 3, 0, 3, 3], ["FSP", 3, 4, 4, 3], ["RE", 3, [0, 4, 1, 5, 2, 6, 3, 7]], ["CA", 2, 3, 5], ["CHR", 1, "shared", [2]], ["CA", 2, 3, 6], ["CHR", 0, "shared", [3]], ["CA", 1, 4, 6], ["FU", 8, [0, 1]], ["SP", 8, 0, 393216, [8], 1], ["AN", 8, 0, 5], ["AN", 8, 1, 6], ["FU", 5, [0, 1]], ["AN", 5, 0, 5], ["FU", 5, [1, 2]], ["AN", 5, 1, 4], ["FU", 5, [2, 3]], ["AN", 5, 2, 6], ["FU", 3, [0, 1]], ["SP", 3, 0, 512, [1], 1], ["AN", 3, 1, 2], ["FFSP", 3, 0, [4, 3], 1, 1], ["AN", 3, 1, 6], ["FU", 1, [0, 1]], ["SP", 1, 0, 4, [4], 1], ["AN", 1, 1, 2], ["FFSP", 1, 0, [4, 3], 1, 1], ["AN", 1, 1, 6], ["PR", 4, 0, "auto_unroll_max_step$64"]]]], "r": [[0.0155747, 0.0155948, 0.0154126], 0, 1.86355, 1608111965], "v": "v0.4"}
{"i": [["[\"swish_gemm\", 128, 3072, 768]", "metal -keys=metal,gpu -max_num_threads=1024", [-1, 16, 64, 32768, 2147483647, 1024, 2, 8]], [[], [["CI", 4], ["CI", 3], ["CHW", 2, "local"], ["SP", 2, 0, 128, [2, 4, 1, 4], 1], ["SP", 2, 5, 3072, [2, 3, 4, 1], 1], ["SP", 2, 10, 768, [16, 1], 1], ["RE", 2, [0, 5, 1, 6, 2, 7, 10, 11, 3, 8, 12, 4, 9]], ["FSP", 3, 0, 3, 3], ["FSP", 3, 4, 4, 3], ["RE", 3, [0, 4, 1, 5, 2, 6, 3, 7]], ["CA", 2, 3, 5], ["CHR", 1, "shared", [2]], ["CA", 2, 3, 6], ["CHR", 0, "shared", [3]], ["CA", 1, 4, 6], ["FU", 8, [0, 1]], ["SP", 8, 0, 393216, [64], 1], ["AN", 8, 0, 5], ["AN", 8, 1, 6], ["FU", 5, [0, 1]], ["AN", 5, 0, 5], ["FU", 5, [1, 2]], ["AN", 5, 1, 4], ["FU", 5, [2, 3]], ["AN", 5, 2, 6], ["FU", 3, [0, 1]], ["SP", 3, 0, 128, [1], 1], ["AN", 3, 1, 2], ["FFSP", 3, 0, [4, 3], 1, 1], ["AN", 3, 1, 6], ["FU", 1, [0, 1]], ["SP", 1, 0, 128, [1], 1], ["AN", 1, 1, 2], ["FFSP", 1, 0, [4, 3], 1, 1], ["AN", 1, 1, 6], ["PR", 4, 0, "auto_unroll_max_step$512"]]]], "r": [[0.00547191, 0.00547521, 0.00547738], 0, 2.78064, 1608111969], "v": "v0.4"}
{"i": [["[\"swish_gemm\", 128, 3072, 768]", "metal -keys=metal,gpu -max_num_threads=1024", [-1, 16, 64, 32768, 2147483647, 1024, 2, 8]], [[], [["CI", 4], ["CI", 3], ["CHW", 2, "local"], ["SP", 2, 0, 128, [1, 1, 2, 4], 1], ["SP", 2, 5, 3072, [1, 2, 12, 4], 1], ["SP", 2, 10, 768, [6, 2], 1], ["RE", 2, [0, 5, 1, 6, 2, 7, 10, 11, 3, 8, 12, 4, 9]], ["FSP", 3, 0, 3, 3], ["FSP", 3, 4, 4, 3], ["RE", 3, [0, 4, 1, 5, 2, 6, 3, 7]], ["CA", 2, 3, 5], ["CHR", 1, "shared", [2]], ["CA", 2, 3, 6], ["CHR", 0, "shared", [3]], ["CA", 1, 4, 6], ["FU", 8, [0, 1]], ["SP", 8, 0, 393216, [8], 1], ["AN", 8, 0, 5], ["AN", 8, 1, 6], ["FU", 5, [0, 1]], ["AN", 5, 0, 5], ["FU", 5, [1, 2]], ["AN", 5, 1, 4], ["FU", 5, [2, 3]], ["AN", 5, 2, 6], ["FU", 3, [0, 1]], ["SP", 3, 0, 192, [1], 1], ["AN", 3, 1, 2], ["FFSP", 3, 0, [4, 3], 1, 1], ["AN", 3, 1, 6], ["FU", 1, [0, 1]], ["SP", 1, 0, 96, [1], 1], ["AN", 1, 1, 2], ["FFSP", 1, 0, [4, 3], 1, 1], ["AN", 1, 1, 6], ["PR", 4, 0, "auto_unroll_max_step$1024"]]]], "r": [[0.541488, 0.541717, 0.54464], 0, 8.00061, 1608111977], "v": "v0.4"}
{"i": [["[\"swish_gemm\", 128, 3072, 768]", "metal -keys=metal,gpu -max_num_threads=1024", [-1, 16, 64, 32768, 2147483647, 1024, 2, 8]], [[], [["CI", 4], ["CI", 3], ["CHW", 2, "local"], ["SP", 2, 0, 128, [1, 1, 4, 8], 1], ["SP", 2, 5, 3072, [1, 16, 6, 1], 1], ["SP", 2, 10, 768, [24, 1], 1], ["RE", 2, [0, 5, 1, 6, 2, 7, 10, 11, 3, 8, 12, 4, 9]], ["FSP", 3, 0, 3, 3], ["FSP", 3, 4, 4, 3], ["RE", 3, [0, 4, 1, 5, 2, 6, 3, 7]], ["CA", 2, 3, 5], ["CHR", 1, "shared", [2]], ["CA", 2, 3, 6], ["CHR", 0, "shared", [3]], ["CA", 1, 4, 6], ["FU", 8, [0, 1]], ["SP", 8, 0, 393216, [8], 1], ["AN", 8, 0, 5], ["AN", 8, 1, 6], ["FU", 5, [0, 1]], ["AN", 5, 0, 5], ["FU", 5, [1, 2]], ["AN", 5, 1, 4], ["FU", 5, [2, 3]], ["AN", 5, 2, 6], ["FU", 3, [0, 1]], ["SP", 3, 0, 144, [1], 1], ["AN", 3, 1, 2], ["FFSP", 3, 0, [4, 3], 1, 1], ["AN", 3, 1, 6], ["FU", 1, [0, 1]], ["SP", 1, 0, 768, [1], 1], ["AN", 1, 1, 2], ["FFSP", 1, 0, [4, 3], 1, 1], ["AN", 1, 1, 6], ["PR", 4, 0, "auto_unroll_max_step$16"]]]], "r": [[0.0108124, 0.0107985, 0.010803], 0, 1.77726, 1608111979], "v": "v0.4"}
{"i": [["[\"swish_gemm\", 128, 3072, 768]", "metal -keys=metal,gpu -max_num_threads=1024", [-1, 16, 64, 32768, 2147483647, 1024, 2, 8]], [[], [["CI", 4], ["CI", 3], ["CHW", 2, "local"], ["SP", 2, 0, 128, [8, 4, 1, 2], 1], ["SP", 2, 5, 3072, [1, 2, 2, 8], 1], ["SP", 2, 10, 768, [4, 3], 1], ["RE", 2, [0, 5, 1, 6, 2, 7, 10, 11, 3, 8, 12, 4, 9]], ["FSP", 3, 0, 3, 3], ["FSP", 3, 4, 4, 3], ["RE", 3, [0, 4, 1, 5, 2, 6, 3, 7]], ["CA", 2, 3, 5], ["CHR", 1, "shared", [2]], ["CA", 2, 3, 6], ["CHR", 0, "shared", [3]], ["CA", 1, 4, 6], ["FU", 8, [0, 1]], ["SP", 8, 0, 393216, [2], 1], ["AN", 8, 0, 5], ["AN", 8, 1, 6], ["FU", 5, [0, 1]], ["AN", 5, 0, 5], ["FU", 5, [1, 2]], ["AN", 5, 1, 4], ["FU", 5, [2, 3]], ["AN", 5, 2, 6], ["FU", 3, [0, 1]], ["SP", 3, 0, 192, [1], 1], ["AN", 3, 1, 2], ["FFSP", 3, 0, [4, 3], 1, 1], ["AN", 3, 1, 6], ["FU", 1, [0, 1]], ["SP", 1, 0, 24, [2], 1], ["AN", 1, 1, 2], ["FFSP", 1, 0, [4, 3], 1, 1], ["AN", 1, 1, 6], ["PR", 4, 0, "auto_unroll_max_step$0"]]]], "r": [[0.0160464, 0.0160974, 0.0160348], 0, 1.82332, 1608111981], "v": "v0.4"}
{"i": [["[\"swish_gemm\", 128, 3072, 768]", "metal -keys=metal,gpu -max_num_threads=1024", [-1, 16, 64, 32768, 2147483647, 1024, 2, 8]], [[], [["CI", 4], ["CI", 3], ["CHW", 2, "local"], ["SP", 2, 0, 128, [1, 4, 32, 1], 1], ["SP", 2, 5, 3072, [2, 2, 1, 3], 1], ["SP", 2, 10, 768, [1, 8], 1], ["RE", 2, [0, 5, 1, 6, 2, 7, 10, 11, 3, 8, 12, 4, 9]], ["FSP", 3, 0, 3, 3], ["FSP", 3, 4, 4, 3], ["RE", 3, [0, 4, 1, 5, 2, 6, 3, 7]], ["CA", 2, 3, 5], ["CHR", 1, "shared", [2]], ["CA", 2, 3, 6], ["CHR", 0, "shared", [3]], ["CA", 1, 4, 6], ["FU", 8, [0, 1]], ["SP", 8, 0, 393216, [8], 1], ["AN", 8, 0, 5], ["AN", 8, 1, 6], ["FU", 5, [0, 1]], ["AN", 5, 0, 5], ["FU", 5, [1, 2]], ["AN", 5, 1, 4], ["FU", 5, [2, 3]], ["AN", 5, 2, 6], ["FU", 3, [0, 1]], ["SP", 3, 0, 24, [8], 1], ["AN", 3, 1, 2], ["FFSP", 3, 0, [4, 3], 1, 1], ["AN", 3, 1, 6], ["FU", 1, [0, 1]], ["SP", 1, 0, 256, [1], 1], ["AN", 1, 1, 2], ["FFSP", 1, 0, [4, 3], 1, 1], ["AN", 1, 1, 6], ["PR", 4, 0, "auto_unroll_max_step$16"]]]], "r": [[0.00886601, 0.00885522, 0.00885772], 0, 1.80614, 1608111983], "v": "v0.4"}
{"i": [["[\"swish_gemm\", 128, 3072, 768]", "metal -keys=metal,gpu -max_num_threads=1024", [-1, 16, 64, 32768, 2147483647, 1024, 2, 8]], [[], [["CI", 4], ["CI", 3], ["CHW", 2, "local"], ["SP", 2, 0, 128, [2, 8, 1, 1], 1], ["SP", 2, 5, 3072, [1, 3, 4, 1], 1], ["SP", 2, 10, 768, [4, 32], 1], ["RE", 2, [0, 5, 1, 6, 2, 7, 10, 11, 3, 8, 12, 4, 9]], ["FSP", 3, 0, 3, 3], ["FSP", 3, 4, 4, 3], ["RE", 3, [0, 4, 1, 5, 2, 6, 3, 7]], ["CA", 2, 3, 5], ["CHR", 1, "shared", [2]], ["CA", 2, 3, 6], ["CHR", 0, "shared", [3]], ["CA", 1, 4, 6], ["FU", 8, [0, 1]], ["SP", 8, 0, 393216, [8], 1], ["AN", 8, 0, 5], ["AN", 8, 1, 6], ["FU", 5, [0, 1]], ["AN", 5, 0, 5], ["FU", 5, [1, 2]], ["AN", 5, 1, 4], ["FU", 5, [2, 3]], ["AN", 5, 2, 6], ["FU", 3, [0, 1]], ["SP", 3, 0, 512, [4], 1], ["AN", 3, 1, 2], ["FFSP", 3, 0, [4, 3], 1, 1], ["AN", 3, 1, 6], ["FU", 1, [0, 1]], ["SP", 1, 0, 128, [8], 1], ["AN", 1, 1, 2], ["FFSP", 1, 0, [4, 3], 1, 1], ["AN", 1, 1, 6], ["PR", 4, 0, "auto_unroll_max_step$512"]]]], "r": [[0.0077735, 0.00775742, 0.00777164], 0, 2.82686, 1608111986], "v": "v0.4"}
{"i": [["[\"swish_gemm\", 128, 3072, 768]", "metal -keys=metal,gpu -max_num_threads=1024", [-1, 16, 64, 32768, 2147483647, 1024, 2, 8]], [[], [["CI", 4], ["CI", 3], ["CHW", 2, "local"], ["SP", 2, 0, 128, [1, 8, 1, 8], 1], ["SP", 2, 5, 3072, [1, 2, 1, 12], 1], ["SP", 2, 10, 768, [16, 3], 1], ["RE", 2, [0, 5, 1, 6, 2, 7, 10, 11, 3, 8, 12, 4, 9]], ["FSP", 3, 0, 3, 3], ["FSP", 3, 4, 4, 3], ["RE", 3, [0, 4, 1, 5, 2, 6, 3, 7]], ["CA", 2, 3, 5], ["CHR", 1, "shared", [2]], ["CA", 2, 3, 6], ["CHR", 0, "shared", [3]], ["CA", 1, 4, 6], ["FU", 8, [0, 1]], ["SP", 8, 0, 393216, [8], 1], ["AN", 8, 0, 5], ["AN", 8, 1, 6], ["FU", 5, [0, 1]], ["AN", 5, 0, 5], ["FU", 5, [1, 2]], ["AN", 5, 1, 4], ["FU", 5, [2, 3]], ["AN", 5, 2, 6], ["FU", 3, [0, 1]], ["SP", 3, 0, 576, [1], 1], ["AN", 3, 1, 2], ["FFSP", 3, 0, [4, 3], 1, 1], ["AN", 3, 1, 6], ["FU", 1, [0, 1]], ["SP", 1, 0, 384, [1], 1], ["AN", 1, 1, 2], ["FFSP", 1, 0, [4, 3], 1, 1], ["AN", 1, 1, 6], ["PR", 4, 0, "auto_unroll_max_step$0"]]]], "r": [[0.0112192, 0.0112287, 0.011224], 0, 1.86441, 1608111988], "v": "v0.4"}
{"i": [["[\"swish_gemm\", 128, 3072, 768]", "metal -keys=metal,gpu -max_num_threads=1024", [-1, 16, 64, 32768, 2147483647, 1024, 2, 8]], [[], [["CI", 4], ["CI", 3], ["CHW", 2, "local"], ["SP", 2, 0, 128, [1, 4, 16, 1], 1], ["SP", 2, 5, 3072, [2, 2, 8, 8], 1], ["SP", 2, 10, 768, [1, 24], 1], ["RE", 2, [0, 5, 1, 6, 2, 7, 10, 11, 3, 8, 12, 4, 9]], ["FSP", 3, 0, 3, 3], ["FSP", 3, 4, 4, 3], ["RE", 3, [0, 4, 1, 5, 2, 6, 3, 7]], ["CA", 2, 3, 5], ["CHR", 1, "shared", [2]], ["CA", 2, 3, 6], ["CHR", 0, "shared", [3]], ["CA", 1, 4, 6], ["FU", 8, [0, 1]], ["SP", 8, 0, 393216, [8], 1], ["AN", 8, 0, 5], ["AN", 8, 1, 6], ["FU", 5, [0, 1]], ["AN", 5, 0, 5], ["FU", 5, [1, 2]], ["AN", 5, 1, 4], ["FU", 5, [2, 3]], ["AN", 5, 2, 6], ["FU", 3, [0, 1]], ["SP", 3, 0, 1536, [1], 1], ["AN", 3, 1, 2], ["FFSP", 3, 0, [4, 3], 1, 1], ["AN", 3, 1, 6], ["FU", 1, [0, 1]], ["SP", 1, 0, 384, [2], 1], ["AN", 1, 1, 2], ["FFSP", 1, 0, [4, 3], 1, 1], ["AN", 1, 1, 6], ["PR", 4, 0, "auto_unroll_max_step$1024"]]]], "r": [[0.057501, 0.0576121, 0.0579145], 0, 4.01375, 1608111993], "v": "v0.4"}
{"i": [["[\"swish_gemm\", 128, 3072, 768]", "metal -keys=metal,gpu -max_num_threads=1024", [-1, 16, 64, 32768, 2147483647, 1024, 2, 8]], [[], [["CI", 4], ["CI", 3], ["CHW", 2, "local"], ["SP", 2, 0, 128, [2, 1, 4, 4], 1], ["SP", 2, 5, 3072, [1, 64, 1, 2], 1], ["SP", 2, 10, 768, [6, 1], 1], ["RE", 2, [0, 5, 1, 6, 2, 7, 10, 11, 3, 8, 12, 4, 9]], ["FSP", 3, 0, 3, 3], ["FSP", 3, 4, 4, 3], ["RE", 3, [0, 4, 1, 5, 2, 6, 3, 7]], ["CA", 2, 3, 5], ["CHR", 1, "shared", [2]], ["CA", 2, 3, 6], ["CHR", 0, "shared", [3]], ["CA", 1, 4, 6], ["FU", 8, [0, 1]], ["SP", 8, 0, 393216, [8], 1], ["AN", 8, 0, 5], ["AN", 8, 1, 6], ["FU", 5, [0, 1]], ["AN", 5, 0, 5], ["FU", 5, [1, 2]], ["AN", 5, 1, 4], ["FU", 5, [2, 3]], ["AN", 5, 2, 6], ["FU", 3, [0, 1]], ["SP", 3, 0, 48, [1], 1], ["AN", 3, 1, 2], ["FFSP", 3, 0, [4, 3], 1, 1], ["AN", 3, 1, 6], ["FU", 1, [0, 1]], ["SP", 1, 0, 96, [8], 1], ["AN", 1, 1, 2], ["FFSP", 1, 0, [4, 3], 1, 1], ["AN", 1, 1, 6], ["PR", 4, 0, "auto_unroll_max_step$512"]]]], "r": [[0.0102716, 0.0102669, 0.0102627], 0, 2.591, 1608111996], "v": "v0.4"}
{"i": [["[\"swish_gemm\", 128, 3072, 768]", "metal -keys=metal,gpu -max_num_threads=1024", [-1, 16, 64, 32768, 2147483647, 1024, 2, 8]], [[], [["CI", 4], ["CI", 3], ["CHW", 2, "local"], ["SP", 2, 0, 128, [2, 2, 1, 4], 1], ["SP", 2, 5, 3072, [1, 96, 4, 2], 1], ["SP", 2, 10, 768, [2, 4], 1], ["RE", 2, [0, 5, 1, 6, 2, 7, 10, 11, 3, 8, 12, 4, 9]], ["FSP", 3, 0, 3, 3], ["FSP", 3, 4, 4, 3], ["RE", 3, [0, 4, 1, 5, 2, 6, 3, 7]], ["CA", 2, 3, 5], ["CHR", 1, "shared", [2]], ["CA", 2, 3, 6], ["CHR", 0, "shared", [3]], ["CA", 1, 4, 6], ["FU", 8, [0, 1]], ["SP", 8, 0, 393216, [8], 1], ["AN", 8, 0, 5], ["AN", 8, 1, 6], ["FU", 5, [0, 1]], ["AN", 5, 0, 5], ["FU", 5, [1, 2]], ["AN", 5, 1, 4], ["FU", 5, [2, 3]], ["AN", 5, 2, 6], ["FU", 3, [0, 1]], ["SP", 3, 0, 64, [1], 1], ["AN", 3, 1, 2], ["FFSP", 3, 0, [4, 3], 1, 1], ["AN", 3, 1, 6], ["FU", 1, [0, 1]], ["SP", 1, 0, 32, [1], 1], ["AN", 1, 1, 2], ["FFSP", 1, 0, [4, 3], 1, 1], ["AN", 1, 1, 6], ["PR", 4, 0, "auto_unroll_max_step$1024"]]]], "r": [[0.00167346, 0.00167286, 0.00167615], 0, 2.90402, 1608111999], "v": "v0.4"}
{"i": [["[\"swish_gemm\", 128, 3072, 768]", "metal -keys=metal,gpu -max_num_threads=1024", [-1, 16, 64, 32768, 2147483647, 1024, 2, 8]], [[], [["CI", 4], ["CI", 3], ["CHW", 2, "local"], ["SP", 2, 0, 128, [1, 8, 1, 16], 1], ["SP", 2, 5, 3072, [1, 8, 8, 8], 1], ["SP", 2, 10, 768, [4, 1], 1], ["RE", 2, [0, 5, 1, 6, 2, 7, 10, 11, 3, 8, 12, 4, 9]], ["FSP", 3, 0, 3, 3], ["FSP", 3, 4, 4, 3], ["RE", 3, [0, 4, 1, 5, 2, 6, 3, 7]], ["CA", 2, 3, 5], ["CHR", 1, "shared", [2]], ["CA", 2, 3, 6], ["CHR", 0, "shared", [3]], ["CA", 1, 4, 6], ["FU", 8, [0, 1]], ["SP", 8, 0, 393216, [64], 1], ["AN", 8, 0, 5], ["AN", 8, 1, 6], ["FU", 5, [0, 1]], ["AN", 5, 0, 5], ["FU", 5, [1, 2]], ["AN", 5, 1, 4], ["FU", 5, [2, 3]], ["AN", 5, 2, 6], ["FU", 3, [0, 1]], ["SP", 3, 0, 128, [1], 1], ["AN", 3, 1, 2], ["FFSP", 3, 0, [4, 3], 1, 1], ["AN", 3, 1, 6], ["FU", 1, [0, 1]], ["SP", 1, 0, 64, [1], 1], ["AN", 1, 1, 2], ["FFSP", 1, 0, [4, 3], 1, 1], ["AN", 1, 1, 6], ["PR", 4, 0, "auto_unroll_max_step$512"]]]], "r": [[0.0476115, 0.0475955, 0.0475898], 0, 2.24777, 1608112001], "v": "v0.4"}
{"i": [["[\"swish_gemm\", 128, 3072, 768]", "metal -keys=metal,gpu -max_num_threads=1024", [-1, 16, 64, 32768, 2147483647, 1024, 2, 8]], [[], [["CI", 4], ["CI", 3], ["CHW", 2, "local"], ["SP", 2, 0, 128, [1, 4, 16, 1], 1], ["SP", 2, 5, 3072, [2, 2, 32, 2], 1], ["SP", 2, 10, 768, [1, 24], 1], ["RE", 2, [0, 5, 1, 6, 2, 7, 10, 11, 3, 8, 12, 4, 9]], ["FSP", 3, 0, 3, 3], ["FSP", 3, 4, 4, 3], ["RE", 3, [0, 4, 1, 5, 2, 6, 3, 7]], ["CA", 2, 3, 5], ["CHR", 1, "shared", [2]], ["CA", 2, 3, 6], ["CHR", 0, "shared", [3]], ["CA", 1, 4, 6], ["FU", 8, [0, 1]], ["SP", 8, 0, 393216, [8], 1], ["AN", 8, 0, 5], ["AN", 8, 1, 6], ["FU", 5, [0, 1]], ["AN", 5, 0, 5], ["FU", 5, [1, 2]], ["AN", 5, 1, 4], ["FU", 5, [2, 3]], ["AN", 5, 2, 6], ["FU", 3, [0, 1]], ["SP", 3, 0, 1536, [1], 1], ["AN", 3, 1, 2], ["FFSP", 3, 0, [4, 3], 1, 1], ["AN", 3, 1, 6], ["FU", 1, [0, 1]], ["SP", 1, 0, 384, [1], 1], ["AN", 1, 1, 2], ["FFSP", 1, 0, [4, 3], 1, 1], ["AN", 1, 1, 6], ["PR", 4, 0, "auto_unroll_max_step$1024"]]]], "r": [[0.0429654, 0.0429755, 0.042977], 0, 3.40088, 1608112005], "v": "v0.4"}
{"i": [["[\"swish_gemm\", 128, 3072, 768]", "metal -keys=metal,gpu -max_num_threads=1024", [-1, 16, 64, 32768, 2147483647, 1024, 2, 8]], [[], [["CI", 4], ["CI", 3], ["CHW", 2, "local"], ["SP", 2, 0, 128, [1, 16, 8, 1], 1], ["SP", 2, 5, 3072, [1, 24, 8, 2], 1], ["SP", 2, 10, 768, [16, 1], 1], ["RE", 2, [0, 5, 1, 6, 2, 7, 10, 11, 3, 8, 12, 4, 9]], ["FSP", 3, 0, 3, 3], ["FSP", 3, 4, 4, 3], ["RE", 3, [0, 4, 1, 5, 2, 6, 3, 7]], ["CA", 2, 3, 5], ["CHR", 1, "shared", [2]], ["CA", 2, 3, 6], ["CHR", 0, "shared", [3]], ["CA", 1, 4, 6], ["FU", 8, [0, 1]], ["SP", 8, 0, 393216, [8], 1], ["AN", 8, 0, 5], ["AN", 8, 1, 6], ["FU", 5, [0, 1]], ["AN", 5, 0, 5], ["FU", 5, [1, 2]], ["AN", 5, 1, 4], ["FU", 5, [2, 3]], ["AN", 5, 2, 6], ["FU", 3, [0, 1]], ["SP", 3, 0, 256, [1], 1], ["AN", 3, 1, 2], ["FFSP", 3, 0, [4, 3], 1, 1], ["AN", 3, 1, 6], ["FU", 1, [0, 1]], ["SP", 1, 0, 128, [1], 1], ["AN", 1, 1, 2], ["FFSP", 1, 0, [4, 3], 1, 1], ["AN", 1, 1, 6], ["PR", 4, 0, "auto_unroll_max_step$0"]]]], "r": [[0.0140038, 0.014006, 0.0140047], 0, 1.70444, 1608112007], "v": "v0.4"}
{"i": [["[\"swish_gemm\", 128, 3072, 768]", "metal -keys=metal,gpu -max_num_threads=1024", [-1, 16, 64, 32768, 2147483647, 1024, 2, 8]], [[], [["CI", 4], ["CI", 3], ["CHW", 2, "local"], ["SP", 2, 0, 128, [2, 16, 1, 2], 1], ["SP", 2, 5, 3072, [1, 2, 2, 8], 1], ["SP", 2, 10, 768, [4, 3], 1], ["RE", 2, [0, 5, 1, 6, 2, 7, 10, 11, 3, 8, 12, 4, 9]], ["FSP", 3, 0, 3, 3], ["FSP", 3, 4, 4, 3], ["RE", 3, [0, 4, 1, 5, 2, 6, 3, 7]], ["CA", 2, 3, 5], ["CHR", 1, "shared", [2]], ["CA", 2, 3, 6], ["CHR", 0, "shared", [3]], ["CA", 1, 4, 6], ["FU", 8, [0, 1]], ["SP", 8, 0, 393216, [8], 1], ["AN", 8, 0, 5], ["AN", 8, 1, 6], ["FU", 5, [0, 1]], ["AN", 5, 0, 5], ["FU", 5, [1, 2]], ["AN", 5, 1, 4], ["FU", 5, [2, 3]], ["AN", 5, 2, 6], ["FU", 3, [0, 1]], ["SP", 3, 0, 192, [1], 1], ["AN", 3, 1, 2], ["FFSP", 3, 0, [4, 3], 1, 1], ["AN", 3, 1, 6], ["FU", 1, [0, 1]], ["SP", 1, 0, 24, [1], 1], ["AN", 1, 1, 2], ["FFSP", 1, 0, [4, 3], 1, 1], ["AN", 1, 1, 6], ["PR", 4, 0, "auto_unroll_max_step$0"]]]], "r": [[0.00146024, 0.00146033, 0.00146217], 0, 2.79295, 1608112010], "v": "v0.4"}
